,0,For how long has the couple been dating?,"How many diamonds are on the ring, and what is the diamond color?","In/on what item is the ring presented?
","Who does the new fiancee text first?
",For how long has the couple known the other was going to propose?,Who does the new fiancee hug first?,Wedding Planner,jobphotos/weddingplanner.jpg,,,,,,,,,,,,,,,,,,,,,,,,,,,,,0,3,3,0,0,0,0,0,,,,,,,,,,,,,,,,,,,,,,,,,,,,,,,691.8782597050001,None,691.8782597050001,None,space,6.526647658000002,691.8782597050001,None,698.460858768,None,698.460858768,None,698.460858768,None,space,4.95018260400002,698.460858768,None,703.4768973110001,None,703.4768973110001,None,703.4768973110001,None,space,6.107470531999979,703.4768973110001,None,709.6437326560001,None,709.6437326560001,None,709.6437326560001,None,space,6.933576473999892,709.6437326560001,None,716.627688516,None,716.627688516,None,716.627688516,None,space,7.643098236000014,716.627688516,None,724.2930814630001,None,space,1.9763231950000772,724.2930814630001,None,726.37756134,None,726.37756134,None,726.37756134,None,726.37756134,None,726.37756134,None,726.37756134,None,726.37756134,None,,,,,,,,,,,,,,,,,,,,,,,,,,,100721,1,3,2,3,2021_Oct_07_1007,training_fmri,3.2.4,59.999874960245975,
,0,,,,,,,,,,,,,,,,,,,,,,,,,,,,,,,,,,,,,0,3,3,0,,,,,,,,,,,,,,,,,,,,,,,,,,,,,,,,,,,,,,,,,,,,,,,,,,,,,,,,,,,,,,,,,,,,,,,,,,,,,,,,,,,,,,,,,,,,,,,,,,,,,,,,,,,,,,,,,,,,,,,,,,,,,,,,,100721,1,3,2,3,2021_Oct_07_1007,training_fmri,3.2.4,59.999874960245975,
,3,"What is the lecture hall like?
","What class are the students in, and what is the day’s lecture about?
","What is something taught in lecture?
","What is the next assessment/assignment for the class, and when is it scheduled/due?","What class are the students in, and what was yesterday’s lecture about?","What is the lecture hall’s max capacity?
",Dean of Academic Studies,jobphotos/dean.jpg,,,,,,,,,,,,,,,,,,,,,,,,,,,,,,,,,,,,,0,0,0,3,0,0,0,0,,,,,,,,,,,,,,,,,,,,,,,,,,,,,,,,,,,,,,,,,,,,,,,,,,,,,,,,,,,,,,,,,,,,,,,,,,,,,,,,,,,,,,,,,,,740.2108501760001,None,741.24314484,None,space,1.0786586250001164,741.24314484,None,741.24314484,None,742.4279306590001,None,742.4279306590001,None,742.4279306590001,None,742.4279306590001,None,742.4279306590001,None,742.4279306590001,None,742.4279306590001,None,,,100721,1,3,2,3,2021_Oct_07_1007,training_fmri,3.2.4,59.999874960245975,
,3,"What is the lecture hall like?
","What class are the students in, and what is the day’s lecture about?
","What is something taught in lecture?
","What is the next assessment/assignment for the class, and when is it scheduled/due?","What class are the students in, and what was yesterday’s lecture about?","What is the lecture hall’s max capacity?
",Dean of Academic Studies,jobphotos/dean.jpg,,,,,,,,,,,,,,,,,,,,,,,,,,,,,,,,,,,,,0,0,0,3,1,0,1,0,,,,,,,,,,,,,,,,,,,,,,,,,,,,,,,,,,,,,,,,,,,,,,,,,,,,,,,,,,,,,,,,,,,,,,,,,,,,,,,,,,,,,,,,,,,,,758.511290552,None,space,0.6891889620001166,758.511290552,None,758.511290552,None,759.326481204,None,759.326481204,None,759.326481204,None,759.326481204,None,759.326481204,None,759.326481204,None,759.326481204,None,,,100721,1,3,2,3,2021_Oct_07_1007,training_fmri,3.2.4,59.999874960245975,
,3,,,,,,,,,,,,,,,,,,,,,,,,,,,,,,,,,,,,,,,,,,,,,0,0,0,3,,,,,,,,,,,,,,,,,,,,,,,,,,,,,,,,,,,,,,,,,,,,,,,,,,,,,,,,,,,,,,,,,,,,,,,,,,,,,,,,,,,,,,,,,,,,,,,,,,,,,,,,,,,,,,,,,,,,,,,,,100721,1,3,2,3,2021_Oct_07_1007,training_fmri,3.2.4,59.999874960245975,
,0,For how long has the couple been dating?,"How many diamonds are on the ring, and what is the diamond color?","In/on what item is the ring presented?
","Who does the new fiancee text first?
",For how long has the couple known the other was going to propose?,Who does the new fiancee hug first?,Wedding Planner,jobphotos/weddingplanner.jpg,,,,,,,,,,,,,,,,,,,,,,,,,,,,,,,,,,,,,0,1,1,0,0,0,0,0,,,,,,,,,,,,,,,,,,,,,,,,,,,,,,,,,,,,,,,,,,,,,,,,,,,,,,,,,,,,,,,,,,,,,,,,,,,,,,,,,,,,,,,,,,,,,780.1102555130001,None,space,23.253356574999998,780.1102555130001,None,780.1102555130001,None,803.4758684830001,None,803.4758684830001,None,803.4758684830001,None,803.4758684830001,None,803.4758684830001,None,803.4758684830001,None,803.4758684830001,None,,,100721,1,3,2,3,2021_Oct_07_1007,training_fmri,3.2.4,59.999874960245975,
,0,,,,,,,,,,,,,,,,,,,,,,,,,,,,,,,,,,,,,,,,,,,,,0,1,1,0,,,,,,,,,,,,,,,,,,,,,,,,,,,,,,,,,,,,,,,,,,,,,,,,,,,,,,,,,,,,,,,,,,,,,,,,,,,,,,,,,,,,,,,,,,,,,,,,,,,,,,,,,,,,,,,,,,,,,,,,,100721,1,3,2,3,2021_Oct_07_1007,training_fmri,3.2.4,59.999874960245975,
,2,"What is the grocery store like upon entering?
",What items do the clients pick out to buy?,"How many checkout lanes are open, and which one do the clients step into?
","How much are the groceries, and what method of payment do the clients use?
",What is the grocery store like when the clients leave?,"How many checkout lanes are closed, and which one do the clients step into?","Grocery Store Customer Experience Manager
",jobphotos/gscem.jpg,,,,,,,,,,,,,,,,,,,,,,,,,,,,,,,,,,,,,0,2,2,2,0,0,0,0,,,,,,,,,,,,,,,,,,,,,,,,,,,,,,,,,,,,,,,,,,,,,,,,,,,,,,,,,,,,,,,,,,,,,,,,,,,,,,,,,,,,,,,,,,,,,828.2263864490001,None,space,1.8936784019999777,828.2263864490001,None,828.2263864490001,None,830.2256915350001,None,830.2256915350001,None,830.2256915350001,None,830.2256915350001,None,830.2256915350001,None,830.2256915350001,None,830.2256915350001,None,,,100721,1,3,2,3,2021_Oct_07_1007,training_fmri,3.2.4,59.999874960245975,
,2,,,,,,,,,,,,,,,,,,,,,,,,,,,,,,,,,,,,,,,,,,,,,0,2,2,2,,,,,,,,,,,,,,,,,,,,,,,,,,,,,,,,,,,,,,,,,,,,,,,,,,,,,,,,,,,,,,,,,,,,,,,,,,,,,,,,,,,,,,,,,,,,,,,,,,,,,,,,,,,,,,,,,,,,,,,,,100721,1,3,2,3,2021_Oct_07_1007,training_fmri,3.2.4,59.999874960245975,
,1,What object is the initiator of the interaction holding when he/she first notices the other person?,What is the initial question that begins the conversation between the couple?,When will be the next time the couple meets and for what occasion?,"What time is it when the couple parts?
",What is the initial question that ends the conversation between the couple?,What object is the initiator of the interaction holding when he/she leaves the other person?,Matchmaker,jobphotos/matchmaker.jpg,,,,,,,,,,,,,,,,,,,,,,,,,,,,,,,,,,,,,0,3,3,1,0,0,0,0,,,,,,,,,,,,,,,,,,,,,,,,,,,,,,,,,,,,,,,,,,,,,,,,,,,,,,,,,,,,,,,,,,,,,,,,,,,,,,,,,,,,,,,,,,,,,846.4931093130001,None,space,1.1863523039999109,846.4931093130001,None,846.4931093130001,None,847.8092417830001,None,847.8092417830001,None,847.8092417830001,None,847.8092417830001,None,847.8092417830001,None,847.8092417830001,None,847.8092417830001,None,,,100721,1,3,2,3,2021_Oct_07_1007,training_fmri,3.2.4,59.999874960245975,
,1,What object is the initiator of the interaction holding when he/she first notices the other person?,What is the initial question that begins the conversation between the couple?,When will be the next time the couple meets and for what occasion?,"What time is it when the couple parts?
",What is the initial question that ends the conversation between the couple?,What object is the initiator of the interaction holding when he/she leaves the other person?,Matchmaker,jobphotos/matchmaker.jpg,,,,,,,,,,,,,,,,,,,,,,,,,,,,,,,,,,,,,0,3,3,1,1,0,1,0,,,,,,,,,,,,,,,,,,,,,,,,,,,,,,,,,,,,,,,,,,,,,,,,,,,,,,,,,,,,,,,,,,,,,,,,,,,,,,,,,,,,,,,,,,,,,872.6260342170001,None,space,0.512246629999936,872.6260342170001,None,872.6260342170001,None,873.2759408530001,None,873.2759408530001,None,873.2759408530001,None,873.2759408530001,None,873.2759408530001,None,873.2759408530001,None,873.2759408530001,None,,,100721,1,3,2,3,2021_Oct_07_1007,training_fmri,3.2.4,59.999874960245975,
,1,,,,,,,,,,,,,,,,,,,,,,,,,,,,,,,,,,,,,,,,,,,,,0,3,3,1,,,,,,,,,,,,,,,,,,,,,,,,,,,,,,,,,,,,,,,,,,,,,,,,,,,,,,,,,,,,,,,,,,,,,,,,,,,,,,,,,,,,,,,,,,,,,,,,,,,,,,,,,,,,,,,,,,,,,,,,,100721,1,3,2,3,2021_Oct_07_1007,training_fmri,3.2.4,59.999874960245975,
,,,,,,,,,,,,,,,,,,,,,,,,,,,,,,,,,,,,,,,,,,,,,,,,,,,,,,,,,,,,,,,,,,,,,,,,,,,,,,,,,,,,,,,,,,,,,,,,,,,,,,,,,,,,,,,,,,,,,,,,,,,,,,,,,,,,,,,,,,,,,,,,,,,,,,,,,,,,,,,,,,,,,,,,897.074723987,None,,,,,,,,,,
