instruct_text,count,Q1,Q2,Q3,Q4,D1,D2,roleName,rolePic,instruct1.thisRepN,instruct1.thisTrialN,instruct1.thisN,instruct1.thisIndex,instruct3.thisRepN,instruct3.thisTrialN,instruct3.thisN,instruct3.thisIndex,instruct4.thisRepN,instruct4.thisTrialN,instruct4.thisN,instruct4.thisIndex,instruct5.thisRepN,instruct5.thisTrialN,instruct5.thisN,instruct5.thisIndex,count_4.thisRepN,count_4.thisTrialN,count_4.thisN,count_4.thisIndex,trials_5.thisRepN,trials_5.thisTrialN,trials_5.thisN,trials_5.thisIndex,instruct6.thisRepN,instruct6.thisTrialN,instruct6.thisN,instruct6.thisIndex,trials.thisRepN,trials.thisTrialN,trials.thisN,trials.thisIndex,trials_2.thisRepN,trials_2.thisTrialN,trials_2.thisN,trials_2.thisIndex,trials_4.thisRepN,trials_4.thisTrialN,trials_4.thisN,trials_4.thisIndex,trials_3.thisRepN,trials_3.thisTrialN,trials_3.thisN,trials_3.thisIndex,text.started,text.stopped,key_resp.keys,key_resp.rt,key_resp.started,key_resp.stopped,key_resp_6.keys,key_resp_6.rt,key_resp_6.started,key_resp_6.stopped,text_12.started,text_12.stopped,image_11.started,image_11.stopped,image_12.started,image_12.stopped,text_17.started,text_17.stopped,key_resp_7.keys,key_resp_7.rt,key_resp_7.started,key_resp_7.stopped,text_18.started,text_18.stopped,image_9.started,image_9.stopped,key_resp_14.keys,key_resp_14.rt,key_resp_14.started,key_resp_14.stopped,text_8.started,text_8.stopped,text_9.started,text_9.stopped,image_5.started,image_5.stopped,key_resp_10.keys,key_resp_10.rt,key_resp_10.started,key_resp_10.stopped,text_10.started,text_10.stopped,text_11.started,text_11.stopped,image_6.started,image_6.stopped,key_resp_11.keys,key_resp_11.rt,key_resp_11.started,key_resp_11.stopped,text_13.started,text_13.stopped,text_14.started,text_14.stopped,image_7.started,image_7.stopped,key_resp_12.keys,key_resp_12.rt,key_resp_12.started,key_resp_12.stopped,text_15.started,text_15.stopped,text_16.started,text_16.stopped,image_8.started,image_8.stopped,key_resp_13.keys,key_resp_13.rt,key_resp_13.started,key_resp_13.stopped,text_5.started,text_5.stopped,key_resp_4.keys,key_resp_4.rt,key_resp_4.started,key_resp_4.stopped,question1_2.started,question1_2.stopped,question2_2.started,question2_2.stopped,question3_2.started,question3_2.stopped,question4_2.started,question4_2.stopped,question5_2.started,question5_2.stopped,question6_2.started,question6_2.stopped,image_3.started,image_3.stopped,text_3.started,text_3.stopped,image_2.started,image_2.stopped,key_resp_3.keys,key_resp_3.rt,key_resp_3.started,key_resp_3.stopped,text_4.started,text_4.stopped,question1_3.started,question1_3.stopped,question2_3.started,question2_3.stopped,question3_3.started,question3_3.stopped,question4_3.started,question4_3.stopped,question5_3.started,question5_3.stopped,question6_3.started,question6_3.stopped,image_4.started,image_4.stopped,text_2.started,text_2.stopped,participant,sA,sB,lA,lB,date,expName,psychopyVersion,frameRate,
Welcome to the job simulator task! ,,,,,,,,,,0,0,0,0,,,,,,,,,,,,,,,,,,,,,,,,,,,,,,,,,,,,,,,,,14.301919759000043,None,space,258.933457641,14.301919759000043,None,,,,,,,,,,,,,,,,,,,,,,,,,,,,,,,,,,,,,,,,,,,,,,,,,,,,,,,,,,,,,,,,,,,,,,,,,,,,,,,,,,,,,,,,,,,,,,,,,,,,,,,,,,,,,,,100721,1,3,2,3,2021_Oct_07_1007,training_fmri,3.2.4,59.999874960245975,
In this experiment you will listen to 12 short stories. ,,,,,,,,,,0,1,1,1,,,,,,,,,,,,,,,,,,,,,,,,,,,,,,,,,,,,,,,,,273.283393683,None,space,2.8220318230000885,273.283393683,None,,,,,,,,,,,,,,,,,,,,,,,,,,,,,,,,,,,,,,,,,,,,,,,,,,,,,,,,,,,,,,,,,,,,,,,,,,,,,,,,,,,,,,,,,,,,,,,,,,,,,,,,,,,,,,,100721,1,3,2,3,2021_Oct_07_1007,training_fmri,3.2.4,59.999874960245975,
"During some of these stories, we will ask you to take on the perspective of a type of job. ",,,,,,,,,,0,2,2,2,,,,,,,,,,,,,,,,,,,,,,,,,,,,,,,,,,,,,,,,,276.14949132900006,None,space,4.180019382999944,276.14949132900006,None,,,,,,,,,,,,,,,,,,,,,,,,,,,,,,,,,,,,,,,,,,,,,,,,,,,,,,,,,,,,,,,,,,,,,,,,,,,,,,,,,,,,,,,,,,,,,,,,,,,,,,,,,,,,,,,100721,1,3,2,3,2021_Oct_07_1007,training_fmri,3.2.4,59.999874960245975,
"In other words, you should try to listen to the story from the perspective of that job. This is called “job simulation.”",,,,,,,,,,0,3,3,3,,,,,,,,,,,,,,,,,,,,,,,,,,,,,,,,,,,,,,,,,280.3658737380001,None,space,5.946889296999871,280.3658737380001,None,,,,,,,,,,,,,,,,,,,,,,,,,,,,,,,,,,,,,,,,,,,,,,,,,,,,,,,,,,,,,,,,,,,,,,,,,,,,,,,,,,,,,,,,,,,,,,,,,,,,,,,,,,,,,,,100721,1,3,2,3,2021_Oct_07_1007,training_fmri,3.2.4,59.999874960245975,
You will be told the job to simulate before each story. ,,,,,,,,,,0,4,4,4,,,,,,,,,,,,,,,,,,,,,,,,,,,,,,,,,,,,,,,,,286.349302676,None,space,2.5612708429998747,286.349302676,None,,,,,,,,,,,,,,,,,,,,,,,,,,,,,,,,,,,,,,,,,,,,,,,,,,,,,,,,,,,,,,,,,,,,,,,,,,,,,,,,,,,,,,,,,,,,,,,,,,,,,,,,,,,,,,,100721,1,3,2,3,2021_Oct_07_1007,training_fmri,3.2.4,59.999874960245975,
"Some stories, however, will not have any job assigned to them, and you can simply listen to the story.",,,,,,,,,,,,,,0,0,0,0,,,,,,,,,,,,,,,,,,,,,,,,,,,,,,,,,,,,,288.948991663,None,space,5.32701678300009,288.948991663,None,,,,,,,,,,,,,,,,,,,,,,,,,,,,,,,,,,,,,,,,,,,,,,,,,,,,,,,,,,,,,,,,,,,,,,,,,,,,,,,,,,,,,,,,,,,,,,,,,,,,,,,,,,,,,,,100721,1,3,2,3,2021_Oct_07_1007,training_fmri,3.2.4,59.999874960245975,
"In this part of the experiment outside of the scanner, we will introduce you to four perspectives you will be asked to take on.",,,,,,,,,,,,,,0,1,1,1,,,,,,,,,,,,,,,,,,,,,,,,,,,,,,,,,,,,,294.3154201530001,None,space,6.83634053600008,294.3154201530001,None,,,,,,,,,,,,,,,,,,,,,,,,,,,,,,,,,,,,,,,,,,,,,,,,,,,,,,,,,,,,,,,,,,,,,,,,,,,,,,,,,,,,,,,,,,,,,,,,,,,,,,,,,,,,,,,100721,1,3,2,3,2021_Oct_07_1007,training_fmri,3.2.4,59.999874960245975,
"For each perspective, you'll also learn 4 questions associated with it to use when listening to a story.",,,,,,,,,,,,,,0,2,2,2,,,,,,,,,,,,,,,,,,,,,,,,,,,,,,,,,,,,,301.19940017299996,None,space,6.671610970000074,301.19940017299996,None,,,,,,,,,,,,,,,,,,,,,,,,,,,,,,,,,,,,,,,,,,,,,,,,,,,,,,,,,,,,,,,,,,,,,,,,,,,,,,,,,,,,,,,,,,,,,,,,,,,,,,,,,,,,,,,100721,1,3,2,3,2021_Oct_07_1007,training_fmri,3.2.4,59.999874960245975,
We encourage you to keep these questions in mind while listening to the story and simulating the associated perspective.,,,,,,,,,,,,,,,,,,0,0,0,0,,,,,,,,,,,,,,,,,,,,,,,,,,,,,,,,,307.915404264,None,space,5.733881766000195,307.915404264,None,,,,,,,,,,,,,,,,,,,,,,,,,,,,,,,,,,,,,,,,,,,,,,,,,,,,,,,,,,,,,,,,,,,,,,,,,,,,,,,,,,,,,,,,,,,,,,,,,,,,,,,,,,,,,,,100721,1,3,2,3,2021_Oct_07_1007,training_fmri,3.2.4,59.999874960245975,
"When you are in the scanner, you will listen to the 12 short stories.",,,,,,,,,,,,,,,,,,0,1,1,1,,,,,,,,,,,,,,,,,,,,,,,,,,,,,,,,,313.69917169500013,None,space,3.004925322999952,313.69917169500013,None,,,,,,,,,,,,,,,,,,,,,,,,,,,,,,,,,,,,,,,,,,,,,,,,,,,,,,,,,,,,,,,,,,,,,,,,,,,,,,,,,,,,,,,,,,,,,,,,,,,,,,,,,,,,,,,100721,1,3,2,3,2021_Oct_07_1007,training_fmri,3.2.4,59.999874960245975,
,,,,,,,,,,,,,,,,,,,,,,,,,,,,,,,,,,,,,,,,,,,,,,,,,,,,,,,,,,,,space,9.275477570000021,316.73093216300003,None,,,,,,,,,,,,,,,,,,,,,,,,,,,,,,,,,,,,,,,,,,,,,,,,,,,,,,,,,,,,,,,,,,,,,,,,,,,,,,,,,,,,,,,,,,,,,,,,,,,,,,,,,,,100721,1,3,2,3,2021_Oct_07_1007,training_fmri,3.2.4,59.999874960245975,
"Before listening to each story, you may be assigned one of the perspectives to take on while listening to it.",,,,,,,,,,,,,,,,,,,,,,0,0,0,0,,,,,,,,,,,,,,,,,,,,,,,,,,,,,326.04910810399997,None,space,5.838714699999855,326.04910810399997,None,,,,,316.73093216300003,None,316.73093216300003,None,,,,,,,,,,,,,,,,,,,,,,,,,,,,,,,,,,,,,,,,,,,,,,,,,,,,,,,,,,,,,,,,,,,,,,,,,,,,,,,,,,,,,,,,,,,,,,,,,,,,,,,100721,1,3,2,3,2021_Oct_07_1007,training_fmri,3.2.4,59.999874960245975,
"If a perspective is assigned, you’ll be quizzed on the 4 questions associated with it before listening.",,,,,,,,,,,,,,,,,,,,,,0,1,1,1,,,,,,,,,,,,,,,,,,,,,,,,,,,,,331.931769863,None,space,7.128555902000016,331.931769863,None,,,,,,,,,,,,,,,,,,,,,,,,,,,,,,,,,,,,,,,,,,,,,,,,,,,,,,,,,,,,,,,,,,,,,,,,,,,,,,,,,,,,,,,,,,,,,,,,,,,,,,,,,,,,,,,100721,1,3,2,3,2021_Oct_07_1007,training_fmri,3.2.4,59.999874960245975,
You must pass this quiz to move on to the story.,,,,,,,,,,,,,,,,,,,,,,0,2,2,2,,,,,,,,,,,,,,,,,,,,,,,,,,,,,339.08104066300007,None,space,5.580284236000125,339.08104066300007,None,,,,,,,,,,,,,,,,,,,,,,,,,,,,,,,,,,,,,,,,,,,,,,,,,,,,,,,,,,,,,,,,,,,,,,,,,,,,,,,,,,,,,,,,,,,,,,,,,,,,,,,,,,,,,,,100721,1,3,2,3,2021_Oct_07_1007,training_fmri,3.2.4,59.999874960245975,
"There will be additional tasks after the story listening, but we will explain them when we come to them.",,,,,,,,,,,,,,,,,,,,,,0,3,3,3,,,,,,,,,,,,,,,,,,,,,,,,,,,,,344.6985069320001,None,space,5.636039524999887,344.6985069320001,None,,,,,,,,,,,,,,,,,,,,,,,,,,,,,,,,,,,,,,,,,,,,,,,,,,,,,,,,,,,,,,,,,,,,,,,,,,,,,,,,,,,,,,,,,,,,,,,,,,,,,,,,,,,,,,,100721,1,3,2,3,2021_Oct_07_1007,training_fmri,3.2.4,59.999874960245975,
Are you ready to begin the training on the perspectives?,,,,,,,,,,,,,,,,,,,,,,0,4,4,4,,,,,,,,,,,,,,,,,,,,,,,,,,,,,350.381966743,None,space,3.0994229030000042,350.381966743,None,,,,,,,,,,,,,,,,,,,,,,,,,,,,,,,,,,,,,,,,,,,,,,,,,,,,,,,,,,,,,,,,,,,,,,,,,,,,,,,,,,,,,,,,,,,,,,,,,,,,,,,,,,,,,,,100721,1,3,2,3,2021_Oct_07_1007,training_fmri,3.2.4,59.999874960245975,
The four perspectives are as follows:,,,,,,,,,,,,,,,,,,,,,,0,5,5,5,,,,,,,,,,,,,,,,,,,,,,,,,,,,,353.515066748,None,space,1.2883458369999516,353.515066748,None,,,,,,,,,,,,,,,,,,,,,,,,,,,,,,,,,,,,,,,,,,,,,,,,,,,,,,,,,,,,,,,,,,,,,,,,,,,,,,,,,,,,,,,,,,,,,,,,,,,,,,,,,,,,,,,100721,1,3,2,3,2021_Oct_07_1007,training_fmri,3.2.4,59.999874960245975,
,1,What object is the initiator of the interaction holding when he/she first notices the other person?,What is the initial question that begins the conversation between the couple?,When will be the next time the couple meets and for what occasion?,"What time is it when the couple parts?
",What is the initial question that ends the conversation between the couple?,What object is the initiator of the interaction holding when he/she leaves the other person?,Matchmaker,jobphotos/matchmaker.jpg,,,,,,,,,,,,,,,,,0,0,0,1,0,0,0,0,,,,,,,,,,,,,,,,,,,,,,,,,,,,,,,,,,,354.8809854410001,None,354.8809854410001,None,space,1.563375146999988,354.8809854410001,None,,,,,,,,,,,,,,,,,,,,,,,,,,,,,,,,,,,,,,,,,,,,,,,,,,,,,,,,,,,,,,,,,,,,,,,,,,,,,,,,,,,,,,,,,,,,,,,100721,1,3,2,3,2021_Oct_07_1007,training_fmri,3.2.4,59.999874960245975,
,1,,,,,,,,,,,,,,,,,,,,,,,,,0,0,0,1,,,,,,,,,,,,,,,,,,,,,,,,,,,,,,,,,,,,,,,,,,,,,,,,,,,,,,,,,,,,,,,,,,,,,,,,,,,,,,,,,,,,,,,,,,,,,,,,,,,,,,,,,,,,,,,,,,,,,,,,,,,,,,,,,,,,,,,,,,,,,100721,1,3,2,3,2021_Oct_07_1007,training_fmri,3.2.4,59.999874960245975,
,3,"What is the lecture hall like?
","What class are the students in, and what is the day’s lecture about?
","What is something taught in lecture?
","What is the next assessment/assignment for the class, and when is it scheduled/due?","What class are the students in, and what was yesterday’s lecture about?","What is the lecture hall’s max capacity?
",Dean of Academic Studies,jobphotos/dean.jpg,,,,,,,,,,,,,,,,,0,1,1,3,0,0,0,0,,,,,,,,,,,,,,,,,,,,,,,,,,,,,,,,,,,356.4988701970001,None,356.4988701970001,None,space,1.928604125999982,356.4988701970001,None,,,,,,,,,,,,,,,,,,,,,,,,,,,,,,,,,,,,,,,,,,,,,,,,,,,,,,,,,,,,,,,,,,,,,,,,,,,,,,,,,,,,,,,,,,,,,,,100721,1,3,2,3,2021_Oct_07_1007,training_fmri,3.2.4,59.999874960245975,
,3,,,,,,,,,,,,,,,,,,,,,,,,,0,1,1,3,,,,,,,,,,,,,,,,,,,,,,,,,,,,,,,,,,,,,,,,,,,,,,,,,,,,,,,,,,,,,,,,,,,,,,,,,,,,,,,,,,,,,,,,,,,,,,,,,,,,,,,,,,,,,,,,,,,,,,,,,,,,,,,,,,,,,,,,,,,,,100721,1,3,2,3,2021_Oct_07_1007,training_fmri,3.2.4,59.999874960245975,
,0,For how long has the couple been dating?,"How many diamonds are on the ring, and what is the diamond color?","In/on what item is the ring presented?
","Who does the new fiancee text first?
",For how long has the couple known the other was going to propose?,Who does the new fiancee hug first?,Wedding Planner,jobphotos/weddingplanner.jpg,,,,,,,,,,,,,,,,,0,2,2,0,0,0,0,0,,,,,,,,,,,,,,,,,,,,,,,,,,,,,,,,,,,358.5319177460001,None,358.5319177460001,None,space,1.4563262660001328,358.5319177460001,None,,,,,,,,,,,,,,,,,,,,,,,,,,,,,,,,,,,,,,,,,,,,,,,,,,,,,,,,,,,,,,,,,,,,,,,,,,,,,,,,,,,,,,,,,,,,,,,100721,1,3,2,3,2021_Oct_07_1007,training_fmri,3.2.4,59.999874960245975,
,0,,,,,,,,,,,,,,,,,,,,,,,,,0,2,2,0,,,,,,,,,,,,,,,,,,,,,,,,,,,,,,,,,,,,,,,,,,,,,,,,,,,,,,,,,,,,,,,,,,,,,,,,,,,,,,,,,,,,,,,,,,,,,,,,,,,,,,,,,,,,,,,,,,,,,,,,,,,,,,,,,,,,,,,,,,,,,100721,1,3,2,3,2021_Oct_07_1007,training_fmri,3.2.4,59.999874960245975,
,2,"What is the grocery store like upon entering?
",What items do the clients pick out to buy?,"How many checkout lanes are open, and which one do the clients step into?
","How much are the groceries, and what method of payment do the clients use?
",What is the grocery store like when the clients leave?,"How many checkout lanes are closed, and which one do the clients step into?","Grocery Store Customer Experience Manager
",jobphotos/gscem.jpg,,,,,,,,,,,,,,,,,0,3,3,2,0,0,0,0,,,,,,,,,,,,,,,,,,,,,,,,,,,,,,,,,,,360.06594640899993,None,360.06594640899993,None,space,2.963128030000007,360.06594640899993,None,,,,,,,,,,,,,,,,,,,,,,,,,,,,,,,,,,,,,,,,,,,,,,,,,,,,,,,,,,,,,,,,,,,,,,,,,,,,,,,,,,,,,,,,,,,,,,,100721,1,3,2,3,2021_Oct_07_1007,training_fmri,3.2.4,59.999874960245975,
,2,,,,,,,,,,,,,,,,,,,,,,,,,0,3,3,2,,,,,,,,,,,,,,,,,,,,,,,,,,,,,,,,,,,,,,,,,,,,,,,,,,,,,,,,,,,,,,,,,,,,,,,,,,,,,,,,,,,,,,,,,,,,,,,,,,,,,,,,,,,,,,,,,,,,,,,,,,,,,,,,,,,,,,,,,,,,,100721,1,3,2,3,2021_Oct_07_1007,training_fmri,3.2.4,59.999874960245975,
You’ll become acquainted with them more in learning the 4 questions associated with each perspective.,,,,,,,,,,,,,,,,,,,,,,,,,,,,,,,,,,0,0,0,0,,,,,,,,,,,,,,,,,363.06464399800007,None,space,5.1696128910000425,363.06464399800007,None,,,,,,,,,,,,,,,,,,,,,,,,,,,,,,,,,,,,,,,,,,,,,,,,,,,,,,,,,,,,,,,,,,,,,,,,,,,,,,,,,,,,,,,,,,,,,,,,,,,,,,,,,,,,,,,100721,1,3,2,3,2021_Oct_07_1007,training_fmri,3.2.4,59.999874960245975,
"For each perspective, you'll go through all four questions in a sequence.",,,,,,,,,,,,,,,,,,,,,,,,,,,,,,,,,,0,1,1,1,,,,,,,,,,,,,,,,,368.281510992,None,space,3.6151678169999286,368.281510992,None,,,,,,,,,,,,,,,,,,,,,,,,,,,,,,,,,,,,,,,,,,,,,,,,,,,,,,,,,,,,,,,,,,,,,,,,,,,,,,,,,,,,,,,,,,,,,,,,,,,,,,,,,,,,,,,100721,1,3,2,3,2021_Oct_07_1007,training_fmri,3.2.4,59.999874960245975,
Then you'll be presented with a quiz and have to indicate which questions you saw in the order in which they appeared in the sequence.,,,,,,,,,,,,,,,,,,,,,,,,,,,,,,,,,,0,2,2,2,,,,,,,,,,,,,,,,,371.93129670999997,None,space,7.324908621999839,371.93129670999997,None,,,,,,,,,,,,,,,,,,,,,,,,,,,,,,,,,,,,,,,,,,,,,,,,,,,,,,,,,,,,,,,,,,,,,,,,,,,,,,,,,,,,,,,,,,,,,,,,,,,,,,,,,,,,,,,100721,1,3,2,3,2021_Oct_07_1007,training_fmri,3.2.4,59.999874960245975,
You'll indicate the question you select by pressing the number key corresponding to the number in front of the question.,,,,,,,,,,,,,,,,,,,,,,,,,,,,,,,,,,0,3,3,3,,,,,,,,,,,,,,,,,379.29800539999997,None,space,6.396159534999924,379.29800539999997,None,,,,,,,,,,,,,,,,,,,,,,,,,,,,,,,,,,,,,,,,,,,,,,,,,,,,,,,,,,,,,,,,,,,,,,,,,,,,,,,,,,,,,,,,,,,,,,,,,,,,,,,,,,,,,,,100721,1,3,2,3,2021_Oct_07_1007,training_fmri,3.2.4,59.999874960245975,
"If you make the wrong selection, you'll get the 4 questions presented in the correct order again and restart the quiz.",,,,,,,,,,,,,,,,,,,,,,,,,,,,,,,,,,0,4,4,4,,,,,,,,,,,,,,,,,385.7313062569999,None,space,5.892296272000067,385.7313062569999,None,,,,,,,,,,,,,,,,,,,,,,,,,,,,,,,,,,,,,,,,,,,,,,,,,,,,,,,,,,,,,,,,,,,,,,,,,,,,,,,,,,,,,,,,,,,,,,,,,,,,,,,,,,,,,,,100721,1,3,2,3,2021_Oct_07_1007,training_fmri,3.2.4,59.999874960245975,
"After you've passed the quizzes for each perspective, you'll do all of them a final time, but without seeing the correct order of the questions beforehand.",,,,,,,,,,,,,,,,,,,,,,,,,,,,,,,,,,0,5,5,5,,,,,,,,,,,,,,,,,391.6643275619999,None,space,5.919259799000201,391.6643275619999,None,,,,,,,,,,,,,,,,,,,,,,,,,,,,,,,,,,,,,,,,,,,,,,,,,,,,,,,,,,,,,,,,,,,,,,,,,,,,,,,,,,,,,,,,,,,,,,,,,,,,,,,,,,,,,,,100721,1,3,2,3,2021_Oct_07_1007,training_fmri,3.2.4,59.999874960245975,
Press space to begin!,,,,,,,,,,,,,,,,,,,,,,,,,,,,,,,,,,0,6,6,6,,,,,,,,,,,,,,,,,397.613849868,None,space,0.9492931600000247,397.613849868,None,,,,,,,,,,,,,,,,,,,,,,,,,,,,,,,,,,,,,,,,,,,,,,,,,,,,,,,,,,,,,,,,,,,,,,,,,,,,,,,,,,,,,,,,,,,,,,,,,,,,,,,,,,,,,,,100721,1,3,2,3,2021_Oct_07_1007,training_fmri,3.2.4,59.999874960245975,
,1,What object is the initiator of the interaction holding when he/she first notices the other person?,What is the initial question that begins the conversation between the couple?,When will be the next time the couple meets and for what occasion?,"What time is it when the couple parts?
",What is the initial question that ends the conversation between the couple?,What object is the initiator of the interaction holding when he/she leaves the other person?,Matchmaker,jobphotos/matchmaker.jpg,,,,,,,,,,,,,,,,,,,,,,,,,,,,,0,0,0,1,0,0,0,0,,,,,,,,,,,,,,,,,,,,,,,,,,,,,,,398.61357076000013,None,398.61357076000013,None,space,8.90168999299999,398.61357076000013,None,407.5817011450001,None,407.5817011450001,None,407.5817011450001,None,space,17.698161288999927,407.5817011450001,None,425.33097503399995,None,425.33097503399995,None,425.33097503399995,None,space,7.23717535999981,425.33097503399995,None,432.63135902,None,432.63135902,None,432.63135902,None,space,6.2483547279998675,432.63135902,None,438.93146295600013,None,438.93146295600013,None,438.93146295600013,None,space,4.690450964000092,438.93146295600013,None,443.6465651200001,None,space,3.6022149479999825,443.6465651200001,None,447.3976661219999,None,447.3976661219999,None,447.3976661219999,None,447.3976661219999,None,447.3976661219999,None,447.3976661219999,None,447.3976661219999,None,,,,,,,,,,,,,,,,,,,,,,,,,,,100721,1,3,2,3,2021_Oct_07_1007,training_fmri,3.2.4,59.999874960245975,
,1,What object is the initiator of the interaction holding when he/she first notices the other person?,What is the initial question that begins the conversation between the couple?,When will be the next time the couple meets and for what occasion?,"What time is it when the couple parts?
",What is the initial question that ends the conversation between the couple?,What object is the initiator of the interaction holding when he/she leaves the other person?,Matchmaker,jobphotos/matchmaker.jpg,,,,,,,,,,,,,,,,,,,,,,,,,,,,,0,0,0,1,1,0,1,0,,,,,,,,,,,,,,,,,,,,,,,,,,,,,,,476.47937254499993,None,476.47937254499993,None,space,3.688112894999904,476.47937254499993,None,480.21334040600004,None,480.21334040600004,None,480.21334040600004,None,space,5.2707715210001425,480.21334040600004,None,485.52991868000004,None,485.52991868000004,None,485.52991868000004,None,space,2.0210137070000656,485.52991868000004,None,487.59642682899994,None,487.59642682899994,None,487.59642682899994,None,space,3.0171469880001496,487.59642682899994,None,490.66333837599996,None,490.66333837599996,None,490.66333837599996,None,space,0.8862307489998784,490.66333837599996,None,491.57993988700014,None,space,0.8948261760001515,491.57993988700014,None,492.597228502,None,492.597228502,None,492.597228502,None,492.597228502,None,492.597228502,None,492.597228502,None,492.597228502,None,,,,,,,,,,,,,,,,,,,,,,,,,,,100721,1,3,2,3,2021_Oct_07_1007,training_fmri,3.2.4,59.999874960245975,
,1,,,,,,,,,,,,,,,,,,,,,,,,,,,,,,,,,,,,,0,0,0,1,,,,,,,,,,,,,,,,,,,,,,,,,,,,,,,,,,,,,,,,,,,,,,,,,,,,,,,,,,,,,,,,,,,,,,,,,,,,,,,,,,,,,,,,,,,,,,,,,,,,,,,,,,,,,,,,,,,,,,,,,,,,,,,,,100721,1,3,2,3,2021_Oct_07_1007,training_fmri,3.2.4,59.999874960245975,
,3,"What is the lecture hall like?
","What class are the students in, and what is the day’s lecture about?
","What is something taught in lecture?
","What is the next assessment/assignment for the class, and when is it scheduled/due?","What class are the students in, and what was yesterday’s lecture about?","What is the lecture hall’s max capacity?
",Dean of Academic Studies,jobphotos/dean.jpg,,,,,,,,,,,,,,,,,,,,,,,,,,,,,0,1,1,3,0,0,0,0,,,,,,,,,,,,,,,,,,,,,,,,,,,,,,,532.380999598,None,532.380999598,None,space,1.5651451339999767,532.380999598,None,534.01292582,None,534.01292582,None,534.01292582,None,space,1.9180477029999565,534.01292582,None,535.9966648740001,None,535.9966648740001,None,535.9966648740001,None,space,4.981628677999879,535.9966648740001,None,541.0299199240001,None,541.0299199240001,None,541.0299199240001,None,space,6.296109816000126,541.0299199240001,None,547.380013387,None,547.380013387,None,547.380013387,None,space,6.9815136869999606,547.380013387,None,554.37923583,None,space,0.6813048120000076,554.37923583,None,555.162884628,None,555.162884628,None,555.162884628,None,555.162884628,None,555.162884628,None,555.162884628,None,555.162884628,None,,,,,,,,,,,,,,,,,,,,,,,,,,,100721,1,3,2,3,2021_Oct_07_1007,training_fmri,3.2.4,59.999874960245975,
,3,"What is the lecture hall like?
","What class are the students in, and what is the day’s lecture about?
","What is something taught in lecture?
","What is the next assessment/assignment for the class, and when is it scheduled/due?","What class are the students in, and what was yesterday’s lecture about?","What is the lecture hall’s max capacity?
",Dean of Academic Studies,jobphotos/dean.jpg,,,,,,,,,,,,,,,,,,,,,,,,,,,,,0,1,1,3,1,0,1,0,,,,,,,,,,,,,,,,,,,,,,,,,,,,,,,558.278483396,None,558.278483396,None,space,1.7250024009999834,558.278483396,None,560.045770423,None,560.045770423,None,560.045770423,None,space,0.8415680660000362,560.045770423,None,560.929269685,None,560.929269685,None,560.929269685,None,space,1.5121577540000999,560.929269685,None,562.479537036,None,562.479537036,None,562.479537036,None,space,2.6267226839997875,562.479537036,None,565.145589512,None,565.145589512,None,565.145589512,None,space,6.586998757999936,565.145589512,None,571.76137903,None,space,0.6919263730001148,571.76137903,None,572.56243765,None,572.56243765,None,572.56243765,None,572.56243765,None,572.56243765,None,572.56243765,None,572.56243765,None,,,,,,,,,,,,,,,,,,,,,,,,,,,100721,1,3,2,3,2021_Oct_07_1007,training_fmri,3.2.4,59.999874960245975,
,3,,,,,,,,,,,,,,,,,,,,,,,,,,,,,,,,,,,,,0,1,1,3,,,,,,,,,,,,,,,,,,,,,,,,,,,,,,,,,,,,,,,,,,,,,,,,,,,,,,,,,,,,,,,,,,,,,,,,,,,,,,,,,,,,,,,,,,,,,,,,,,,,,,,,,,,,,,,,,,,,,,,,,,,,,,,,,100721,1,3,2,3,2021_Oct_07_1007,training_fmri,3.2.4,59.999874960245975,
,2,"What is the grocery store like upon entering?
",What items do the clients pick out to buy?,"How many checkout lanes are open, and which one do the clients step into?
","How much are the groceries, and what method of payment do the clients use?
",What is the grocery store like when the clients leave?,"How many checkout lanes are closed, and which one do the clients step into?","Grocery Store Customer Experience Manager
",jobphotos/gscem.jpg,,,,,,,,,,,,,,,,,,,,,,,,,,,,,0,2,2,2,0,0,0,0,,,,,,,,,,,,,,,,,,,,,,,,,,,,,,,591.6951458799999,None,591.6951458799999,None,space,1.950207938000176,591.6951458799999,None,593.7133145820001,None,593.7133145820001,None,593.7133145820001,None,space,5.019653638999898,593.7133145820001,None,598.7965161070001,None,598.7965161070001,None,598.7965161070001,None,space,4.306423112999937,598.7965161070001,None,603.1795971619999,None,603.1795971619999,None,603.1795971619999,None,space,6.20584153599998,603.1795971619999,None,609.4620560769999,None,609.4620560769999,None,609.4620560769999,None,space,6.893633019999925,609.4620560769999,None,616.3774690330001,None,space,0.9758899379999093,616.3774690330001,None,617.4616864100001,None,617.4616864100001,None,617.4616864100001,None,617.4616864100001,None,617.4616864100001,None,617.4616864100001,None,617.4616864100001,None,,,,,,,,,,,,,,,,,,,,,,,,,,,100721,1,3,2,3,2021_Oct_07_1007,training_fmri,3.2.4,59.999874960245975,
,2,"What is the grocery store like upon entering?
",What items do the clients pick out to buy?,"How many checkout lanes are open, and which one do the clients step into?
","How much are the groceries, and what method of payment do the clients use?
",What is the grocery store like when the clients leave?,"How many checkout lanes are closed, and which one do the clients step into?","Grocery Store Customer Experience Manager
",jobphotos/gscem.jpg,,,,,,,,,,,,,,,,,,,,,,,,,,,,,0,2,2,2,1,0,1,0,,,,,,,,,,,,,,,,,,,,,,,,,,,,,,,649.161972803,None,649.161972803,None,space,0.6974338259999513,649.161972803,None,649.8938084850001,None,649.8938084850001,None,649.8938084850001,None,space,1.0716809119999198,649.8938084850001,None,651.0113915920001,None,651.0113915920001,None,651.0113915920001,None,space,2.5200319739999486,651.0113915920001,None,653.578236543,None,653.578236543,None,653.578236543,None,space,2.0350180569998884,653.578236543,None,655.661719771,None,655.661719771,None,655.661719771,None,space,1.6374971589998495,655.661719771,None,657.3275220400001,None,space,0.6577210039999954,657.3275220400001,None,658.0952220010001,None,658.0952220010001,None,658.0952220010001,None,658.0952220010001,None,658.0952220010001,None,658.0952220010001,None,658.0952220010001,None,,,,,,,,,,,,,,,,,,,,,,,,,,,100721,1,3,2,3,2021_Oct_07_1007,training_fmri,3.2.4,59.999874960245975,
,2,,,,,,,,,,,,,,,,,,,,,,,,,,,,,,,,,,,,,0,2,2,2,,,,,,,,,,,,,,,,,,,,,,,,,,,,,,,,,,,,,,,,,,,,,,,,,,,,,,,,,,,,,,,,,,,,,,,,,,,,,,,,,,,,,,,,,,,,,,,,,,,,,,,,,,,,,,,,,,,,,,,,,,,,,,,,,100721,1,3,2,3,2021_Oct_07_1007,training_fmri,3.2.4,59.999874960245975,
