,3,"What is the lecture hall like?
","What class are the students in, and what is the day’s lecture about?
","What is something taught in lecture?
","What is the next assessment/assignment for the class, and when is it scheduled/due?","What class are the students in, and what was yesterday’s lecture about?","What is the lecture hall’s max capacity?
",Dean of Academic Studies,jobphotos/dean.jpg,,,,,,,,,,,,,,,,,,,,,,,,,,,,,,,,,,,,,0,2,2,3,0,0,0,0,,,,,,,,,,,,,,,,,,,,,,,,,,,,,,,,,,,,,,,,,,,,,,,,,,,,,,,,,,,,,,,,,,,,,,,,,,,,,,,,,,,,,,,,,,,,,388.91426606000095,None,space,0.9322236939988215,388.91426606000095,None,388.91426606000095,None,389.96353833000103,None,389.96353833000103,None,389.96353833000103,None,389.96353833000103,None,389.96353833000103,None,389.96353833000103,None,389.96353833000103,None,,,011821,1,2,0,3,2022_Jan_18_0906,training_fmri,3.2.4,59.47438560029179,
,3,,,,,,,,,,,,,,,,,,,,,,,,,,,,,,,,,,,,,,,,,,,,,0,2,2,3,,,,,,,,,,,,,,,,,,,,,,,,,,,,,,,,,,,,,,,,,,,,,,,,,,,,,,,,,,,,,,,,,,,,,,,,,,,,,,,,,,,,,,,,,,,,,,,,,,,,,,,,,,,,,,,,,,,,,,,,,011821,1,2,0,3,2022_Jan_18_0906,training_fmri,3.2.4,59.47438560029179,
,2,How is the restaurant decorated?,What are the menus like?,"What does each client order?
",How do the clients like the food?,How is the restaurant supplied?,How do the clients like the chairs?,Restaurant Critic,jobphotos/restaurant_critic.jpg,,,,,,,,,,,,,,,,,,,,,,,,,,,,,,,,,,,,,0,3,3,2,0,0,0,0,,,,,,,,,,,,,,,,,,,,,,,,,,,,,,,,,,,,,,,,,,,,,,,,,,,,,,,,,,,,,,,,,,,,,,,,,,,,,,,,,,,,,,,,,,,,,416.2301517619999,None,space,1.1947555960032332,416.2301517619999,None,416.2301517619999,None,417.5301572040007,None,417.5301572040007,None,417.5301572040007,None,417.5301572040007,None,417.5301572040007,None,417.5301572040007,None,417.5301572040007,None,,,011821,1,2,0,3,2022_Jan_18_0906,training_fmri,3.2.4,59.47438560029179,
,2,,,,,,,,,,,,,,,,,,,,,,,,,,,,,,,,,,,,,,,,,,,,,0,3,3,2,,,,,,,,,,,,,,,,,,,,,,,,,,,,,,,,,,,,,,,,,,,,,,,,,,,,,,,,,,,,,,,,,,,,,,,,,,,,,,,,,,,,,,,,,,,,,,,,,,,,,,,,,,,,,,,,,,,,,,,,,011821,1,2,0,3,2022_Jan_18_0906,training_fmri,3.2.4,59.47438560029179,
,,,,,,,,,,,,,,,,,,,,,,,,,,,,,,,,,,,,,,,,,,,,,,,,,,,,,,,,,,,,,,,,,,,,,,,,,,,,,,,,,,,,,,,,,,,,,,,,,,,,,,,,,,,,,,,,,,,,,,,,,,,,,,,,,,,,,,,,,,,,,,,,,,,,,,,,,,,,,,,,,,,,,,,,427.82961815199815,None,,,,,,,,,,
