,1,What is each business person’s job title?,"How much money is at stake in the initial offer made?
",What is the name of the other industry competitor? ,With what gesture do the business partners secure the deal?,What is each business person’s salary?,How much money is at stake in the final offer made?,Business Reporter,jobphotos/business_reporter.jpg,,,,,,,,,,,,,,,,,,,,,,,,,,,,,0,3,3,1,1,0,1,0,,,,,,,,,,,,,,,,,,,,,,,,,,,,,,,333.7355482290004,None,333.7355482290004,None,space,0.693127189999359,333.7355482290004,None,334.4677662190006,None,334.4677662190006,None,334.4677662190006,None,space,1.3067664129994228,334.4677662190006,None,335.818519507,None,335.818519507,None,335.818519507,None,space,1.4858548069987592,335.818519507,None,337.3858972809994,None,337.3858972809994,None,337.3858972809994,None,space,1.1003935819990147,337.3858972809994,None,338.5352252930006,None,338.5352252930006,None,338.5352252930006,None,space,1.1733705719998397,338.5352252930006,None,339.7349685429999,None,space,0.4094358620004641,339.7349685429999,None,340.23532535400045,None,340.23532535400045,None,340.23532535400045,None,340.23532535400045,None,340.23532535400045,None,340.23532535400045,None,340.23532535400045,None,,,,,,,,,,,,,,,,,,,,,,,,,,,022021,0,2,0,1,2021_Feb_20_1016,training_fmri,3.2.4,60.03798843661997,
,1,What is each business person’s job title?,"How much money is at stake in the initial offer made?
",What is the name of the other industry competitor? ,With what gesture do the business partners secure the deal?,What is each business person’s salary?,How much money is at stake in the final offer made?,Business Reporter,jobphotos/business_reporter.jpg,,,,,,,,,,,,,,,,,,,,,,,,,,,,,0,3,3,1,2,0,2,0,,,,,,,,,,,,,,,,,,,,,,,,,,,,,,,346.1352851369993,None,346.1352851369993,None,space,0.6068972350003605,346.1352851369993,None,346.7842702430007,None,346.7842702430007,None,346.7842702430007,None,space,0.23175852399981522,346.7842702430007,None,347.0517713909994,None,347.0517713909994,None,347.0517713909994,None,space,0.6883381469997403,347.0517713909994,None,347.785209701,None,347.785209701,None,347.785209701,None,space,0.26773994700124604,347.785209701,None,348.1017258369993,None,348.1017258369993,None,348.1017258369993,None,space,0.20233545300106925,348.1017258369993,None,348.3351862519994,None,space,0.3389920580011676,348.3351862519994,None,348.76812343500023,None,348.76812343500023,None,348.76812343500023,None,348.76812343500023,None,348.76812343500023,None,348.76812343500023,None,348.76812343500023,None,,,,,,,,,,,,,,,,,,,,,,,,,,,022021,0,2,0,1,2021_Feb_20_1016,training_fmri,3.2.4,60.03798843661997,
,1,,,,,,,,,,,,,,,,,,,,,,,,,,,,,,,,,,,,,0,3,3,1,,,,,,,,,,,,,,,,,,,,,,,,,,,,,,,,,,,,,,,,,,,,,,,,,,,,,,,,,,,,,,,,,,,,,,,,,,,,,,,,,,,,,,,,,,,,,,,,,,,,,,,,,,,,,,,,,,,,,,,,,,,,,,,,,022021,0,2,0,1,2021_Feb_20_1016,training_fmri,3.2.4,60.03798843661997,
,3,"When the clients arrive at the airport, how much time do they have until their flight departs?
",What is the reason for the hold-up at security?,"Toward which gate are the clients walking?
","What section and seat does each client sit in on the plane?
",Toward which security line are the clients walking?,What section and seat are roped off on the plane?,Airport Customer Experience Manager,jobphotos/acem.jpg,,,,,,,,,,,,,,,,,,,,,,,,,,,,,,,,,,,,,0,0,0,3,0,0,0,0,,,,,,,,,,,,,,,,,,,,,,,,,,,,,,,,,,,,,,,,,,,,,,,,,,,,,,,,,,,,,,,,,,,,,,,,,,,,,,,,,,,,,,,,,,,365.1518460890002,None,366.2180617800004,None,space,2.399854265999238,366.2180617800004,None,366.2180617800004,None,368.7176198260004,None,368.7176198260004,None,368.7176198260004,None,368.7176198260004,None,368.7176198260004,None,368.7176198260004,None,368.7176198260004,None,,,022021,0,2,0,1,2021_Feb_20_1016,training_fmri,3.2.4,60.03798843661997,
,3,,,,,,,,,,,,,,,,,,,,,,,,,,,,,,,,,,,,,,,,,,,,,0,0,0,3,,,,,,,,,,,,,,,,,,,,,,,,,,,,,,,,,,,,,,,,,,,,,,,,,,,,,,,,,,,,,,,,,,,,,,,,,,,,,,,,,,,,,,,,,,,,,,,,,,,,,,,,,,,,,,,,,,,,,,,,,022021,0,2,0,1,2021_Feb_20_1016,training_fmri,3.2.4,60.03798843661997,
,2,How is the restaurant decorated?,What are the menus like?,"What does each client order?
",How do the clients like the food?,How is the restaurant supplied?,How do the clients like the chairs?,Restaurant Critic,jobphotos/restaurant_critic.jpg,,,,,,,,,,,,,,,,,,,,,,,,,,,,,,,,,,,,,0,1,1,2,0,0,0,0,,,,,,,,,,,,,,,,,,,,,,,,,,,,,,,,,,,,,,,,,,,,,,,,,,,,,,,,,,,,,,,,,,,,,,,,,,,,,,,,,,,,,,,,,,,,,386.11918806799986,None,space,0.5892508679989987,386.11918806799986,None,386.11918806799986,None,386.8184238590002,None,386.8184238590002,None,386.8184238590002,None,386.8184238590002,None,386.8184238590002,None,386.8184238590002,None,386.8184238590002,None,,,022021,0,2,0,1,2021_Feb_20_1016,training_fmri,3.2.4,60.03798843661997,
,2,,,,,,,,,,,,,,,,,,,,,,,,,,,,,,,,,,,,,,,,,,,,,0,1,1,2,,,,,,,,,,,,,,,,,,,,,,,,,,,,,,,,,,,,,,,,,,,,,,,,,,,,,,,,,,,,,,,,,,,,,,,,,,,,,,,,,,,,,,,,,,,,,,,,,,,,,,,,,,,,,,,,,,,,,,,,,022021,0,2,0,1,2021_Feb_20_1016,training_fmri,3.2.4,60.03798843661997,
,1,What is each business person’s job title?,"How much money is at stake in the initial offer made?
",What is the name of the other industry competitor? ,With what gesture do the business partners secure the deal?,What is each business person’s salary?,How much money is at stake in the final offer made?,Business Reporter,jobphotos/business_reporter.jpg,,,,,,,,,,,,,,,,,,,,,,,,,,,,,,,,,,,,,0,2,2,1,0,0,0,0,,,,,,,,,,,,,,,,,,,,,,,,,,,,,,,,,,,,,,,,,,,,,,,,,,,,,,,,,,,,,,,,,,,,,,,,,,,,,,,,,,,,,,,,,,,,,403.95107162800014,None,space,4.250578441000471,403.95107162800014,None,403.95107162800014,None,408.3182410339996,None,408.3182410339996,None,408.3182410339996,None,408.3182410339996,None,408.3182410339996,None,408.3182410339996,None,408.3182410339996,None,,,022021,0,2,0,1,2021_Feb_20_1016,training_fmri,3.2.4,60.03798843661997,
,1,What is each business person’s job title?,"How much money is at stake in the initial offer made?
",What is the name of the other industry competitor? ,With what gesture do the business partners secure the deal?,What is each business person’s salary?,How much money is at stake in the final offer made?,Business Reporter,jobphotos/business_reporter.jpg,,,,,,,,,,,,,,,,,,,,,,,,,,,,,,,,,,,,,0,2,2,1,1,0,1,0,,,,,,,,,,,,,,,,,,,,,,,,,,,,,,,,,,,,,,,,,,,,,,,,,,,,,,,,,,,,,,,,,,,,,,,,,,,,,,,,,,,,,,,,,,,,,426.6677235850002,None,space,0.9641912369988859,426.6677235850002,None,426.6677235850002,None,427.73451713599934,None,427.73451713599934,None,427.73451713599934,None,427.73451713599934,None,427.73451713599934,None,427.73451713599934,None,427.73451713599934,None,,,022021,0,2,0,1,2021_Feb_20_1016,training_fmri,3.2.4,60.03798843661997,
,1,,,,,,,,,,,,,,,,,,,,,,,,,,,,,,,,,,,,,,,,,,,,,0,2,2,1,,,,,,,,,,,,,,,,,,,,,,,,,,,,,,,,,,,,,,,,,,,,,,,,,,,,,,,,,,,,,,,,,,,,,,,,,,,,,,,,,,,,,,,,,,,,,,,,,,,,,,,,,,,,,,,,,,,,,,,,,022021,0,2,0,1,2021_Feb_20_1016,training_fmri,3.2.4,60.03798843661997,
,0,For how long has the initiator of the breakup been thinking about breaking up with his/her partner?,"What is the initial reason stated by the initiator for why he/she is breaking up?
","Does the person who is being broken up with want to break up, and what’s the reason stated by them for this?",Who wants what items back as a result of the breakup?,What is the initial reason stated by the initiator for why he/she wanted to meet?,Who wants how many letters burned as a result of the breakup?,"Couples Therapist
",jobphotos/couples.jpg,,,,,,,,,,,,,,,,,,,,,,,,,,,,,,,,,,,,,0,3,3,0,0,0,0,0,,,,,,,,,,,,,,,,,,,,,,,,,,,,,,,,,,,,,,,,,,,,,,,,,,,,,,,,,,,,,,,,,,,,,,,,,,,,,,,,,,,,,,,,,,,,,445.46813086399925,None,space,1.0990346830003546,445.46813086399925,None,445.46813086399925,None,446.6851182419996,None,446.6851182419996,None,446.6851182419996,None,446.6851182419996,None,446.6851182419996,None,446.6851182419996,None,446.6851182419996,None,,,022021,0,2,0,1,2021_Feb_20_1016,training_fmri,3.2.4,60.03798843661997,
,0,,,,,,,,,,,,,,,,,,,,,,,,,,,,,,,,,,,,,,,,,,,,,0,3,3,0,,,,,,,,,,,,,,,,,,,,,,,,,,,,,,,,,,,,,,,,,,,,,,,,,,,,,,,,,,,,,,,,,,,,,,,,,,,,,,,,,,,,,,,,,,,,,,,,,,,,,,,,,,,,,,,,,,,,,,,,,022021,0,2,0,1,2021_Feb_20_1016,training_fmri,3.2.4,60.03798843661997,
,,,,,,,,,,,,,,,,,,,,,,,,,,,,,,,,,,,,,,,,,,,,,,,,,,,,,,,,,,,,,,,,,,,,,,,,,,,,,,,,,,,,,,,,,,,,,,,,,,,,,,,,,,,,,,,,,,,,,,,,,,,,,,,,,,,,,,,,,,,,,,,,,,,,,,,,,,,,,,,,,,,,,,,,474.18356466600017,None,,,,,,,,,,
