,1,What object is the initiator of the interaction holding when he/she first notices the other person?,What is the initial question that begins the conversation between the couple?,When will be the next time the couple meets and for what occasion?,"What time is it when the couple parts?
",What is the initial question that ends the conversation between the couple?,What object is the initiator of the interaction holding when he/she leaves the other person?,Matchmaker,jobphotos/matchmaker.jpg,,,,,,,,,,,,,,,,,,,,,,,,,,,,,,,,,,,,,0,0,0,1,0,0,0,0,,,,,,,,,,,,,,,,,,,,,,,,,,,,,,,,,,,,,,,,,,,,,,,,,,,,,,,,,,,,,,,,,,,,,,,,,,,,,,,,,,,,,,,,,,,472.222556317,None,473.27244101300005,None,space,2.135940067999968,473.27244101300005,None,473.27244101300005,None,475.53965592,None,475.53965592,None,475.53965592,None,475.53965592,None,475.53965592,None,475.53965592,None,475.53965592,None,,,082021,2,3,2,3,2021_Aug_20_1121,training_fmri,3.2.4,59.81927830337786,
,1,What object is the initiator of the interaction holding when he/she first notices the other person?,What is the initial question that begins the conversation between the couple?,When will be the next time the couple meets and for what occasion?,"What time is it when the couple parts?
",What is the initial question that ends the conversation between the couple?,What object is the initiator of the interaction holding when he/she leaves the other person?,Matchmaker,jobphotos/matchmaker.jpg,,,,,,,,,,,,,,,,,,,,,,,,,,,,,,,,,,,,,0,0,0,1,1,0,1,0,,,,,,,,,,,,,,,,,,,,,,,,,,,,,,,,,,,,,,,,,,,,,,,,,,,,,,,,,,,,,,,,,,,,,,,,,,,,,,,,,,,,,,,,,,,,,481.19068014699997,None,space,0.9133354159999953,481.19068014699997,None,481.19068014699997,None,482.223814423,None,482.223814423,None,482.223814423,None,482.223814423,None,482.223814423,None,482.223814423,None,482.223814423,None,,,082021,2,3,2,3,2021_Aug_20_1121,training_fmri,3.2.4,59.81927830337786,
,1,,,,,,,,,,,,,,,,,,,,,,,,,,,,,,,,,,,,,,,,,,,,,0,0,0,1,,,,,,,,,,,,,,,,,,,,,,,,,,,,,,,,,,,,,,,,,,,,,,,,,,,,,,,,,,,,,,,,,,,,,,,,,,,,,,,,,,,,,,,,,,,,,,,,,,,,,,,,,,,,,,,,,,,,,,,,,082021,2,3,2,3,2021_Aug_20_1121,training_fmri,3.2.4,59.81927830337786,
,3,"What is the lecture hall like?
","What class are the students in, and what is the day’s lecture about?
","What is something taught in lecture?
","What is the next assessment/assignment for the class, and when is it scheduled/due?","What class are the students in, and what was yesterday’s lecture about?","What is the lecture hall’s max capacity?
",Dean of Academic Studies,jobphotos/dean.jpg,,,,,,,,,,,,,,,,,,,,,,,,,,,,,,,,,,,,,0,1,1,3,0,0,0,0,,,,,,,,,,,,,,,,,,,,,,,,,,,,,,,,,,,,,,,,,,,,,,,,,,,,,,,,,,,,,,,,,,,,,,,,,,,,,,,,,,,,,,,,,,,,,506.40741832699996,None,space,1.724963043999992,506.40741832699996,None,506.40741832699996,None,508.24070462500003,None,508.24070462500003,None,508.24070462500003,None,508.24070462500003,None,508.24070462500003,None,508.24070462500003,None,508.24070462500003,None,,,082021,2,3,2,3,2021_Aug_20_1121,training_fmri,3.2.4,59.81927830337786,
,3,,,,,,,,,,,,,,,,,,,,,,,,,,,,,,,,,,,,,,,,,,,,,0,1,1,3,,,,,,,,,,,,,,,,,,,,,,,,,,,,,,,,,,,,,,,,,,,,,,,,,,,,,,,,,,,,,,,,,,,,,,,,,,,,,,,,,,,,,,,,,,,,,,,,,,,,,,,,,,,,,,,,,,,,,,,,,082021,2,3,2,3,2021_Aug_20_1121,training_fmri,3.2.4,59.81927830337786,
,2,"What is the grocery store like upon entering?
",What items do the clients pick out to buy?,"How many checkout lanes are open, and which one do the clients step into?
","How much are the groceries, and what method of payment do the clients use?
",What is the grocery store like when the clients leave?,"How many checkout lanes are closed, and which one do the clients step into?","Grocery Store Customer Experience Manager
",jobphotos/gscem.jpg,,,,,,,,,,,,,,,,,,,,,,,,,,,,,,,,,,,,,0,2,2,2,0,0,0,0,,,,,,,,,,,,,,,,,,,,,,,,,,,,,,,,,,,,,,,,,,,,,,,,,,,,,,,,,,,,,,,,,,,,,,,,,,,,,,,,,,,,,,,,,,,,,524.456872684,None,space,1.71735908200003,524.456872684,None,524.456872684,None,526.2889102940001,None,526.2889102940001,None,526.2889102940001,None,526.2889102940001,None,526.2889102940001,None,526.2889102940001,None,526.2889102940001,None,,,082021,2,3,2,3,2021_Aug_20_1121,training_fmri,3.2.4,59.81927830337786,
,2,,,,,,,,,,,,,,,,,,,,,,,,,,,,,,,,,,,,,,,,,,,,,0,2,2,2,,,,,,,,,,,,,,,,,,,,,,,,,,,,,,,,,,,,,,,,,,,,,,,,,,,,,,,,,,,,,,,,,,,,,,,,,,,,,,,,,,,,,,,,,,,,,,,,,,,,,,,,,,,,,,,,,,,,,,,,,082021,2,3,2,3,2021_Aug_20_1121,training_fmri,3.2.4,59.81927830337786,
,0,What is each business person’s job title?,"How much money is at stake in the initial offer made?
",What is the name of the other industry competitor? ,With what gesture do the business partners secure the deal?,What is each business person’s salary?,How much money is at stake in the final offer made?,Business Reporter,jobphotos/business_reporter.jpg,,,,,,,,,,,,,,,,,,,,,,,,,,,,,,,,,,,,,0,3,3,0,0,0,0,0,,,,,,,,,,,,,,,,,,,,,,,,,,,,,,,,,,,,,,,,,,,,,,,,,,,,,,,,,,,,,,,,,,,,,,,,,,,,,,,,,,,,,,,,,,,,,546.572577723,None,space,0.9757311099999697,546.572577723,None,546.572577723,None,547.655062901,None,547.655062901,None,547.655062901,None,547.655062901,None,547.655062901,None,547.655062901,None,547.655062901,None,,,082021,2,3,2,3,2021_Aug_20_1121,training_fmri,3.2.4,59.81927830337786,
,0,,,,,,,,,,,,,,,,,,,,,,,,,,,,,,,,,,,,,,,,,,,,,0,3,3,0,,,,,,,,,,,,,,,,,,,,,,,,,,,,,,,,,,,,,,,,,,,,,,,,,,,,,,,,,,,,,,,,,,,,,,,,,,,,,,,,,,,,,,,,,,,,,,,,,,,,,,,,,,,,,,,,,,,,,,,,,082021,2,3,2,3,2021_Aug_20_1121,training_fmri,3.2.4,59.81927830337786,
,,,,,,,,,,,,,,,,,,,,,,,,,,,,,,,,,,,,,,,,,,,,,,,,,,,,,,,,,,,,,,,,,,,,,,,,,,,,,,,,,,,,,,,,,,,,,,,,,,,,,,,,,,,,,,,,,,,,,,,,,,,,,,,,,,,,,,,,,,,,,,,,,,,,,,,,,,,,,,,,,,,,,,,,563.789220578,None,,,,,,,,,,
