instruct_text,count,Q1,Q2,Q3,Q4,D1,D2,roleName,rolePic,instruct1.thisRepN,instruct1.thisTrialN,instruct1.thisN,instruct1.thisIndex,instruct3.thisRepN,instruct3.thisTrialN,instruct3.thisN,instruct3.thisIndex,instruct4.thisRepN,instruct4.thisTrialN,instruct4.thisN,instruct4.thisIndex,instruct5.thisRepN,instruct5.thisTrialN,instruct5.thisN,instruct5.thisIndex,count_4.thisRepN,count_4.thisTrialN,count_4.thisN,count_4.thisIndex,trials_5.thisRepN,trials_5.thisTrialN,trials_5.thisN,trials_5.thisIndex,instruct6.thisRepN,instruct6.thisTrialN,instruct6.thisN,instruct6.thisIndex,trials.thisRepN,trials.thisTrialN,trials.thisN,trials.thisIndex,trials_2.thisRepN,trials_2.thisTrialN,trials_2.thisN,trials_2.thisIndex,trials_4.thisRepN,trials_4.thisTrialN,trials_4.thisN,trials_4.thisIndex,trials_3.thisRepN,trials_3.thisTrialN,trials_3.thisN,trials_3.thisIndex,text.started,text.stopped,key_resp.keys,key_resp.rt,key_resp.started,key_resp.stopped,key_resp_6.keys,key_resp_6.rt,key_resp_6.started,key_resp_6.stopped,text_12.started,text_12.stopped,image_11.started,image_11.stopped,image_12.started,image_12.stopped,text_17.started,text_17.stopped,key_resp_7.keys,key_resp_7.rt,key_resp_7.started,key_resp_7.stopped,text_18.started,text_18.stopped,image_9.started,image_9.stopped,key_resp_14.keys,key_resp_14.rt,key_resp_14.started,key_resp_14.stopped,text_8.started,text_8.stopped,text_9.started,text_9.stopped,image_5.started,image_5.stopped,key_resp_10.keys,key_resp_10.rt,key_resp_10.started,key_resp_10.stopped,text_10.started,text_10.stopped,text_11.started,text_11.stopped,image_6.started,image_6.stopped,key_resp_11.keys,key_resp_11.rt,key_resp_11.started,key_resp_11.stopped,text_13.started,text_13.stopped,text_14.started,text_14.stopped,image_7.started,image_7.stopped,key_resp_12.keys,key_resp_12.rt,key_resp_12.started,key_resp_12.stopped,text_15.started,text_15.stopped,text_16.started,text_16.stopped,image_8.started,image_8.stopped,key_resp_13.keys,key_resp_13.rt,key_resp_13.started,key_resp_13.stopped,text_5.started,text_5.stopped,key_resp_4.keys,key_resp_4.rt,key_resp_4.started,key_resp_4.stopped,question1_2.started,question1_2.stopped,question2_2.started,question2_2.stopped,question3_2.started,question3_2.stopped,question4_2.started,question4_2.stopped,question5_2.started,question5_2.stopped,question6_2.started,question6_2.stopped,image_3.started,image_3.stopped,text_3.started,text_3.stopped,image_2.started,image_2.stopped,key_resp_3.keys,key_resp_3.rt,key_resp_3.started,key_resp_3.stopped,text_4.started,text_4.stopped,question1_3.started,question1_3.stopped,question2_3.started,question2_3.stopped,question3_3.started,question3_3.stopped,question4_3.started,question4_3.stopped,question5_3.started,question5_3.stopped,question6_3.started,question6_3.stopped,image_4.started,image_4.stopped,text_2.started,text_2.stopped,participant,sA,sB,lA,lB,date,expName,psychopyVersion,frameRate,
Welcome to the job simulator task! ,,,,,,,,,,0,0,0,0,,,,,,,,,,,,,,,,,,,,,,,,,,,,,,,,,,,,,,,,,50.41128414900004,None,space,279.89459804,50.41128414900004,None,,,,,,,,,,,,,,,,,,,,,,,,,,,,,,,,,,,,,,,,,,,,,,,,,,,,,,,,,,,,,,,,,,,,,,,,,,,,,,,,,,,,,,,,,,,,,,,,,,,,,,,,,,,,,,,102121,2,3,0,3,2021_Oct_21_1313,training_fmri,3.2.4,None,
In this experiment you will listen to 12 short stories. ,,,,,,,,,,0,1,1,1,,,,,,,,,,,,,,,,,,,,,,,,,,,,,,,,,,,,,,,,,330.34122694200005,None,space,2.5961701779999657,330.34122694200005,None,,,,,,,,,,,,,,,,,,,,,,,,,,,,,,,,,,,,,,,,,,,,,,,,,,,,,,,,,,,,,,,,,,,,,,,,,,,,,,,,,,,,,,,,,,,,,,,,,,,,,,,,,,,,,,,102121,2,3,0,3,2021_Oct_21_1313,training_fmri,3.2.4,None,
"During some of these stories, we will ask you to take on the perspective of a type of job. ",,,,,,,,,,0,2,2,2,,,,,,,,,,,,,,,,,,,,,,,,,,,,,,,,,,,,,,,,,332.97446179400004,None,space,4.9465541210000765,332.97446179400004,None,,,,,,,,,,,,,,,,,,,,,,,,,,,,,,,,,,,,,,,,,,,,,,,,,,,,,,,,,,,,,,,,,,,,,,,,,,,,,,,,,,,,,,,,,,,,,,,,,,,,,,,,,,,,,,,102121,2,3,0,3,2021_Oct_21_1313,training_fmri,3.2.4,None,
"In other words, you should try to listen to the story from the perspective of that job. This is called “job simulation.”",,,,,,,,,,0,3,3,3,,,,,,,,,,,,,,,,,,,,,,,,,,,,,,,,,,,,,,,,,337.95731948900004,None,space,6.387129444000038,337.95731948900004,None,,,,,,,,,,,,,,,,,,,,,,,,,,,,,,,,,,,,,,,,,,,,,,,,,,,,,,,,,,,,,,,,,,,,,,,,,,,,,,,,,,,,,,,,,,,,,,,,,,,,,,,,,,,,,,,102121,2,3,0,3,2021_Oct_21_1313,training_fmri,3.2.4,None,
You will be told the job to simulate before each story. ,,,,,,,,,,0,4,4,4,,,,,,,,,,,,,,,,,,,,,,,,,,,,,,,,,,,,,,,,,344.39083479,None,space,3.8702263369999628,344.39083479,None,,,,,,,,,,,,,,,,,,,,,,,,,,,,,,,,,,,,,,,,,,,,,,,,,,,,,,,,,,,,,,,,,,,,,,,,,,,,,,,,,,,,,,,,,,,,,,,,,,,,,,,,,,,,,,,102121,2,3,0,3,2021_Oct_21_1313,training_fmri,3.2.4,None,
"Some stories, however, will not have any job assigned to them, and you can simply listen to the story.",,,,,,,,,,,,,,0,0,0,0,,,,,,,,,,,,,,,,,,,,,,,,,,,,,,,,,,,,,348.306815736,None,space,6.0117264279999745,348.306815736,None,,,,,,,,,,,,,,,,,,,,,,,,,,,,,,,,,,,,,,,,,,,,,,,,,,,,,,,,,,,,,,,,,,,,,,,,,,,,,,,,,,,,,,,,,,,,,,,,,,,,,,,,,,,,,,,102121,2,3,0,3,2021_Oct_21_1313,training_fmri,3.2.4,None,
"In this part of the experiment outside of the scanner, we will introduce you to four perspectives you will be asked to take on.",,,,,,,,,,,,,,0,1,1,1,,,,,,,,,,,,,,,,,,,,,,,,,,,,,,,,,,,,,354.35691701300004,None,space,7.12446553399991,354.35691701300004,None,,,,,,,,,,,,,,,,,,,,,,,,,,,,,,,,,,,,,,,,,,,,,,,,,,,,,,,,,,,,,,,,,,,,,,,,,,,,,,,,,,,,,,,,,,,,,,,,,,,,,,,,,,,,,,,102121,2,3,0,3,2021_Oct_21_1313,training_fmri,3.2.4,None,
"For each perspective, you'll also learn 4 questions associated with it to use when listening to a story.",,,,,,,,,,,,,,0,2,2,2,,,,,,,,,,,,,,,,,,,,,,,,,,,,,,,,,,,,,361.50670079200006,None,space,5.570190669000112,361.50670079200006,None,,,,,,,,,,,,,,,,,,,,,,,,,,,,,,,,,,,,,,,,,,,,,,,,,,,,,,,,,,,,,,,,,,,,,,,,,,,,,,,,,,,,,,,,,,,,,,,,,,,,,,,,,,,,,,,102121,2,3,0,3,2021_Oct_21_1313,training_fmri,3.2.4,None,
We encourage you to keep these questions in mind while listening to the story and simulating the associated perspective.,,,,,,,,,,,,,,,,,,0,0,0,0,,,,,,,,,,,,,,,,,,,,,,,,,,,,,,,,,367.12373885600005,None,space,5.998123641999996,367.12373885600005,None,,,,,,,,,,,,,,,,,,,,,,,,,,,,,,,,,,,,,,,,,,,,,,,,,,,,,,,,,,,,,,,,,,,,,,,,,,,,,,,,,,,,,,,,,,,,,,,,,,,,,,,,,,,,,,,102121,2,3,0,3,2021_Oct_21_1313,training_fmri,3.2.4,None,
"When you are in the scanner, you will listen to the 12 short stories.",,,,,,,,,,,,,,,,,,0,1,1,1,,,,,,,,,,,,,,,,,,,,,,,,,,,,,,,,,373.13981412400005,None,space,5.558073931999957,373.13981412400005,None,,,,,,,,,,,,,,,,,,,,,,,,,,,,,,,,,,,,,,,,,,,,,,,,,,,,,,,,,,,,,,,,,,,,,,,,,,,,,,,,,,,,,,,,,,,,,,,,,,,,,,,,,,,,,,,102121,2,3,0,3,2021_Oct_21_1313,training_fmri,3.2.4,None,
,,,,,,,,,,,,,,,,,,,,,,,,,,,,,,,,,,,,,,,,,,,,,,,,,,,,,,,,,,,,space,8.954369378000024,378.72220364300006,None,,,,,,,,,,,,,,,,,,,,,,,,,,,,,,,,,,,,,,,,,,,,,,,,,,,,,,,,,,,,,,,,,,,,,,,,,,,,,,,,,,,,,,,,,,,,,,,,,,,,,,,,,,,102121,2,3,0,3,2021_Oct_21_1313,training_fmri,3.2.4,None,
"Before listening to each story, you may be assigned one of the perspectives to take on while listening to it.",,,,,,,,,,,,,,,,,,,,,,0,0,0,0,,,,,,,,,,,,,,,,,,,,,,,,,,,,,387.72386818200005,None,space,6.442740954999977,387.72386818200005,None,,,,,378.72220364300006,None,378.72220364300006,None,,,,,,,,,,,,,,,,,,,,,,,,,,,,,,,,,,,,,,,,,,,,,,,,,,,,,,,,,,,,,,,,,,,,,,,,,,,,,,,,,,,,,,,,,,,,,,,,,,,,,,,102121,2,3,0,3,2021_Oct_21_1313,training_fmri,3.2.4,None,
"If a perspective is assigned, you’ll be quizzed on the 4 questions associated with it before listening.",,,,,,,,,,,,,,,,,,,,,,0,1,1,1,,,,,,,,,,,,,,,,,,,,,,,,,,,,,394.20642842999996,None,space,7.114062144999934,394.20642842999996,None,,,,,,,,,,,,,,,,,,,,,,,,,,,,,,,,,,,,,,,,,,,,,,,,,,,,,,,,,,,,,,,,,,,,,,,,,,,,,,,,,,,,,,,,,,,,,,,,,,,,,,,,,,,,,,,102121,2,3,0,3,2021_Oct_21_1313,training_fmri,3.2.4,None,
You must pass this quiz to move on to the story.,,,,,,,,,,,,,,,,,,,,,,0,2,2,2,,,,,,,,,,,,,,,,,,,,,,,,,,,,,401.3389020740001,None,space,3.795331502999943,401.3389020740001,None,,,,,,,,,,,,,,,,,,,,,,,,,,,,,,,,,,,,,,,,,,,,,,,,,,,,,,,,,,,,,,,,,,,,,,,,,,,,,,,,,,,,,,,,,,,,,,,,,,,,,,,,,,,,,,,102121,2,3,0,3,2021_Oct_21_1313,training_fmri,3.2.4,None,
"There will be additional tasks after the story listening, but we will explain them when we come to them.",,,,,,,,,,,,,,,,,,,,,,0,3,3,3,,,,,,,,,,,,,,,,,,,,,,,,,,,,,405.17361058200004,None,space,6.573098727999877,405.17361058200004,None,,,,,,,,,,,,,,,,,,,,,,,,,,,,,,,,,,,,,,,,,,,,,,,,,,,,,,,,,,,,,,,,,,,,,,,,,,,,,,,,,,,,,,,,,,,,,,,,,,,,,,,,,,,,,,,102121,2,3,0,3,2021_Oct_21_1313,training_fmri,3.2.4,None,
Are you ready to begin the training on the perspectives?,,,,,,,,,,,,,,,,,,,,,,0,4,4,4,,,,,,,,,,,,,,,,,,,,,,,,,,,,,411.789792478,None,space,3.940405220999992,411.789792478,None,,,,,,,,,,,,,,,,,,,,,,,,,,,,,,,,,,,,,,,,,,,,,,,,,,,,,,,,,,,,,,,,,,,,,,,,,,,,,,,,,,,,,,,,,,,,,,,,,,,,,,,,,,,,,,,102121,2,3,0,3,2021_Oct_21_1313,training_fmri,3.2.4,None,
The four perspectives are as follows:,,,,,,,,,,,,,,,,,,,,,,0,5,5,5,,,,,,,,,,,,,,,,,,,,,,,,,,,,,415.7559430399999,None,space,0.4001000060000024,415.7559430399999,None,,,,,,,,,,,,,,,,,,,,,,,,,,,,,,,,,,,,,,,,,,,,,,,,,,,,,,,,,,,,,,,,,,,,,,,,,,,,,,,,,,,,,,,,,,,,,,,,,,,,,,,,,,,,,,,102121,2,3,0,3,2021_Oct_21_1313,training_fmri,3.2.4,None,
,2,How is the restaurant decorated?,What are the menus like?,"What does each client order?
",How do the clients like the food?,How is the restaurant supplied?,How do the clients like the chairs?,Restaurant Critic,jobphotos/restaurant_critic.jpg,,,,,,,,,,,,,,,,,0,0,0,2,0,0,0,0,,,,,,,,,,,,,,,,,,,,,,,,,,,,,,,,,,,416.22431570799995,None,416.22431570799995,None,space,3.083637293000038,416.22431570799995,None,,,,,,,,,,,,,,,,,,,,,,,,,,,,,,,,,,,,,,,,,,,,,,,,,,,,,,,,,,,,,,,,,,,,,,,,,,,,,,,,,,,,,,,,,,,,,,,102121,2,3,0,3,2021_Oct_21_1313,training_fmri,3.2.4,None,
,2,,,,,,,,,,,,,,,,,,,,,,,,,0,0,0,2,,,,,,,,,,,,,,,,,,,,,,,,,,,,,,,,,,,,,,,,,,,,,,,,,,,,,,,,,,,,,,,,,,,,,,,,,,,,,,,,,,,,,,,,,,,,,,,,,,,,,,,,,,,,,,,,,,,,,,,,,,,,,,,,,,,,,,,,,,,,,102121,2,3,0,3,2021_Oct_21_1313,training_fmri,3.2.4,None,
,1,What object is the initiator of the interaction holding when he/she first notices the other person?,What is the initial question that begins the conversation between the couple?,When will be the next time the couple meets and for what occasion?,"What time is it when the couple parts?
",What is the initial question that ends the conversation between the couple?,What object is the initiator of the interaction holding when he/she leaves the other person?,Matchmaker,jobphotos/matchmaker.jpg,,,,,,,,,,,,,,,,,0,1,1,1,0,0,0,0,,,,,,,,,,,,,,,,,,,,,,,,,,,,,,,,,,,419.37400878099993,None,419.37400878099993,None,space,1.2440389830001095,419.37400878099993,None,,,,,,,,,,,,,,,,,,,,,,,,,,,,,,,,,,,,,,,,,,,,,,,,,,,,,,,,,,,,,,,,,,,,,,,,,,,,,,,,,,,,,,,,,,,,,,,102121,2,3,0,3,2021_Oct_21_1313,training_fmri,3.2.4,None,
,1,,,,,,,,,,,,,,,,,,,,,,,,,0,1,1,1,,,,,,,,,,,,,,,,,,,,,,,,,,,,,,,,,,,,,,,,,,,,,,,,,,,,,,,,,,,,,,,,,,,,,,,,,,,,,,,,,,,,,,,,,,,,,,,,,,,,,,,,,,,,,,,,,,,,,,,,,,,,,,,,,,,,,,,,,,,,,102121,2,3,0,3,2021_Oct_21_1313,training_fmri,3.2.4,None,
,0,What is each business person’s job title?,"How much money is at stake in the initial offer made?
",What is the name of the other industry competitor? ,With what gesture do the business partners secure the deal?,What is each business person’s salary?,How much money is at stake in the final offer made?,Business Reporter,jobphotos/business_reporter.jpg,,,,,,,,,,,,,,,,,0,2,2,0,0,0,0,0,,,,,,,,,,,,,,,,,,,,,,,,,,,,,,,,,,,420.70601401299996,None,420.70601401299996,None,space,1.5028599969998595,420.70601401299996,None,,,,,,,,,,,,,,,,,,,,,,,,,,,,,,,,,,,,,,,,,,,,,,,,,,,,,,,,,,,,,,,,,,,,,,,,,,,,,,,,,,,,,,,,,,,,,,,102121,2,3,0,3,2021_Oct_21_1313,training_fmri,3.2.4,None,
,0,,,,,,,,,,,,,,,,,,,,,,,,,0,2,2,0,,,,,,,,,,,,,,,,,,,,,,,,,,,,,,,,,,,,,,,,,,,,,,,,,,,,,,,,,,,,,,,,,,,,,,,,,,,,,,,,,,,,,,,,,,,,,,,,,,,,,,,,,,,,,,,,,,,,,,,,,,,,,,,,,,,,,,,,,,,,,102121,2,3,0,3,2021_Oct_21_1313,training_fmri,3.2.4,None,
,3,"What is the lecture hall like?
","What class are the students in, and what is the day’s lecture about?
","What is something taught in lecture?
","What is the next assessment/assignment for the class, and when is it scheduled/due?","What class are the students in, and what was yesterday’s lecture about?","What is the lecture hall’s max capacity?
",Dean of Academic Studies,jobphotos/dean.jpg,,,,,,,,,,,,,,,,,0,3,3,3,0,0,0,0,,,,,,,,,,,,,,,,,,,,,,,,,,,,,,,,,,,422.27268364199995,None,422.27268364199995,None,space,2.3121916039999633,422.27268364199995,None,,,,,,,,,,,,,,,,,,,,,,,,,,,,,,,,,,,,,,,,,,,,,,,,,,,,,,,,,,,,,,,,,,,,,,,,,,,,,,,,,,,,,,,,,,,,,,,102121,2,3,0,3,2021_Oct_21_1313,training_fmri,3.2.4,None,
,3,,,,,,,,,,,,,,,,,,,,,,,,,0,3,3,3,,,,,,,,,,,,,,,,,,,,,,,,,,,,,,,,,,,,,,,,,,,,,,,,,,,,,,,,,,,,,,,,,,,,,,,,,,,,,,,,,,,,,,,,,,,,,,,,,,,,,,,,,,,,,,,,,,,,,,,,,,,,,,,,,,,,,,,,,,,,,102121,2,3,0,3,2021_Oct_21_1313,training_fmri,3.2.4,None,
You’ll become acquainted with them more in learning the 4 questions associated with each perspective.,,,,,,,,,,,,,,,,,,,,,,,,,,,,,,,,,,0,0,0,0,,,,,,,,,,,,,,,,,424.623380194,None,space,5.5044762550001,424.623380194,None,,,,,,,,,,,,,,,,,,,,,,,,,,,,,,,,,,,,,,,,,,,,,,,,,,,,,,,,,,,,,,,,,,,,,,,,,,,,,,,,,,,,,,,,,,,,,,,,,,,,,,,,,,,,,,,102121,2,3,0,3,2021_Oct_21_1313,training_fmri,3.2.4,None,
"For each perspective, you'll go through all four questions in a sequence.",,,,,,,,,,,,,,,,,,,,,,,,,,,,,,,,,,0,1,1,1,,,,,,,,,,,,,,,,,430.17268891599997,None,space,4.2084576069999,430.17268891599997,None,,,,,,,,,,,,,,,,,,,,,,,,,,,,,,,,,,,,,,,,,,,,,,,,,,,,,,,,,,,,,,,,,,,,,,,,,,,,,,,,,,,,,,,,,,,,,,,,,,,,,,,,,,,,,,,102121,2,3,0,3,2021_Oct_21_1313,training_fmri,3.2.4,None,
Then you'll be presented with a quiz and have to indicate which questions you saw in the order in which they appeared in the sequence.,,,,,,,,,,,,,,,,,,,,,,,,,,,,,,,,,,0,2,2,2,,,,,,,,,,,,,,,,,434.42279564699993,None,space,8.307134456000085,434.42279564699993,None,,,,,,,,,,,,,,,,,,,,,,,,,,,,,,,,,,,,,,,,,,,,,,,,,,,,,,,,,,,,,,,,,,,,,,,,,,,,,,,,,,,,,,,,,,,,,,,,,,,,,,,,,,,,,,,102121,2,3,0,3,2021_Oct_21_1313,training_fmri,3.2.4,None,
You'll indicate the question you select by pressing the number key corresponding to the number in front of the question.,,,,,,,,,,,,,,,,,,,,,,,,,,,,,,,,,,0,3,3,3,,,,,,,,,,,,,,,,,442.7731427619999,None,space,6.336564545000101,442.7731427619999,None,,,,,,,,,,,,,,,,,,,,,,,,,,,,,,,,,,,,,,,,,,,,,,,,,,,,,,,,,,,,,,,,,,,,,,,,,,,,,,,,,,,,,,,,,,,,,,,,,,,,,,,,,,,,,,,102121,2,3,0,3,2021_Oct_21_1313,training_fmri,3.2.4,None,
"If you make the wrong selection, you'll get the 4 questions presented in the correct order again and restart the quiz.",,,,,,,,,,,,,,,,,,,,,,,,,,,,,,,,,,0,4,4,4,,,,,,,,,,,,,,,,,449.1559391400001,None,space,5.556652215999975,449.1559391400001,None,,,,,,,,,,,,,,,,,,,,,,,,,,,,,,,,,,,,,,,,,,,,,,,,,,,,,,,,,,,,,,,,,,,,,,,,,,,,,,,,,,,,,,,,,,,,,,,,,,,,,,,,,,,,,,,102121,2,3,0,3,2021_Oct_21_1313,training_fmri,3.2.4,None,
"After you've passed the quizzes for each perspective, you'll do all of them a final time, but without seeing the correct order of the questions beforehand.",,,,,,,,,,,,,,,,,,,,,,,,,,,,,,,,,,0,5,5,5,,,,,,,,,,,,,,,,,454.754682646,None,space,6.112161992999972,454.754682646,None,,,,,,,,,,,,,,,,,,,,,,,,,,,,,,,,,,,,,,,,,,,,,,,,,,,,,,,,,,,,,,,,,,,,,,,,,,,,,,,,,,,,,,,,,,,,,,,,,,,,,,,,,,,,,,,102121,2,3,0,3,2021_Oct_21_1313,training_fmri,3.2.4,None,
Press space to begin!,,,,,,,,,,,,,,,,,,,,,,,,,,,,,,,,,,0,6,6,6,,,,,,,,,,,,,,,,,460.888832868,None,space,1.0925136689997998,460.888832868,None,,,,,,,,,,,,,,,,,,,,,,,,,,,,,,,,,,,,,,,,,,,,,,,,,,,,,,,,,,,,,,,,,,,,,,,,,,,,,,,,,,,,,,,,,,,,,,,,,,,,,,,,,,,,,,,102121,2,3,0,3,2021_Oct_21_1313,training_fmri,3.2.4,None,
,0,What is each business person’s job title?,"How much money is at stake in the initial offer made?
",What is the name of the other industry competitor? ,With what gesture do the business partners secure the deal?,What is each business person’s salary?,How much money is at stake in the final offer made?,Business Reporter,jobphotos/business_reporter.jpg,,,,,,,,,,,,,,,,,,,,,,,,,,,,,0,0,0,0,0,0,0,0,,,,,,,,,,,,,,,,,,,,,,,,,,,,,,,462.0388064629999,None,462.0388064629999,None,space,7.858747039000036,462.0388064629999,None,469.9564456339999,None,469.9564456339999,None,469.9564456339999,None,space,12.111754275000067,469.9564456339999,None,482.122659504,None,482.122659504,None,482.122659504,None,space,4.551089599000079,482.122659504,None,486.7391933250001,None,486.7391933250001,None,486.7391933250001,None,space,4.506722456000034,486.7391933250001,None,491.306018301,None,491.306018301,None,491.306018301,None,space,4.9164287150001655,491.306018301,None,496.25434891200007,None,space,2.566262564999988,496.25434891200007,None,498.9391333190001,None,498.9391333190001,None,498.9391333190001,None,498.9391333190001,None,498.9391333190001,None,498.9391333190001,None,498.9391333190001,None,,,,,,,,,,,,,,,,,,,,,,,,,,,102121,2,3,0,3,2021_Oct_21_1313,training_fmri,3.2.4,None,
,0,,,,,,,,,,,,,,,,,,,,,,,,,,,,,,,,,,,,,0,0,0,0,,,,,,,,,,,,,,,,,,,,,,,,,,,,,,,,,,,,,,,,,,,,,,,,,,,,,,,,,,,,,,,,,,,,,,,,,,,,,,,,,,,,,,,,,,,,,,,,,,,,,,,,,,,,,,,,,,,,,,,,,,,,,,,,,102121,2,3,0,3,2021_Oct_21_1313,training_fmri,3.2.4,None,
,2,How is the restaurant decorated?,What are the menus like?,"What does each client order?
",How do the clients like the food?,How is the restaurant supplied?,How do the clients like the chairs?,Restaurant Critic,jobphotos/restaurant_critic.jpg,,,,,,,,,,,,,,,,,,,,,,,,,,,,,0,1,1,2,0,0,0,0,,,,,,,,,,,,,,,,,,,,,,,,,,,,,,,545.054180503,None,545.054180503,None,space,1.9261176930001511,545.054180503,None,547.038766224,None,547.038766224,None,547.038766224,None,space,3.312266763000025,547.038766224,None,550.405159202,None,550.405159202,None,550.405159202,None,space,1.7307914020000226,550.405159202,None,552.1891054580001,None,552.1891054580001,None,552.1891054580001,None,space,3.0017852769999536,552.1891054580001,None,555.2549406150001,None,555.2549406150001,None,555.2549406150001,None,space,5.001739719999932,555.2549406150001,None,560.2875406989999,None,space,0.7658452959999522,560.2875406989999,None,561.1551112070001,None,561.1551112070001,None,561.1551112070001,None,561.1551112070001,None,561.1551112070001,None,561.1551112070001,None,561.1551112070001,None,,,,,,,,,,,,,,,,,,,,,,,,,,,102121,2,3,0,3,2021_Oct_21_1313,training_fmri,3.2.4,None,
,2,,,,,,,,,,,,,,,,,,,,,,,,,,,,,,,,,,,,,0,1,1,2,,,,,,,,,,,,,,,,,,,,,,,,,,,,,,,,,,,,,,,,,,,,,,,,,,,,,,,,,,,,,,,,,,,,,,,,,,,,,,,,,,,,,,,,,,,,,,,,,,,,,,,,,,,,,,,,,,,,,,,,,,,,,,,,,102121,2,3,0,3,2021_Oct_21_1313,training_fmri,3.2.4,None,
,3,"What is the lecture hall like?
","What class are the students in, and what is the day’s lecture about?
","What is something taught in lecture?
","What is the next assessment/assignment for the class, and when is it scheduled/due?","What class are the students in, and what was yesterday’s lecture about?","What is the lecture hall’s max capacity?
",Dean of Academic Studies,jobphotos/dean.jpg,,,,,,,,,,,,,,,,,,,,,,,,,,,,,0,2,2,3,0,0,0,0,,,,,,,,,,,,,,,,,,,,,,,,,,,,,,,580.9886936519999,None,580.9886936519999,None,space,2.1448562079999647,580.9886936519999,None,583.1878776840001,None,583.1878776840001,None,583.1878776840001,None,space,4.782851072999847,583.1878776840001,None,588.0383543800001,None,588.0383543800001,None,588.0383543800001,None,space,6.706008352999788,588.0383543800001,None,594.8044628800001,None,594.8044628800001,None,594.8044628800001,None,space,4.6194814999998925,594.8044628800001,None,599.504678754,None,599.504678754,None,599.504678754,None,space,3.5928927850000036,599.504678754,None,603.1207471340001,None,space,1.3134811149998313,603.1207471340001,None,604.5375214549999,None,604.5375214549999,None,604.5375214549999,None,604.5375214549999,None,604.5375214549999,None,604.5375214549999,None,604.5375214549999,None,,,,,,,,,,,,,,,,,,,,,,,,,,,102121,2,3,0,3,2021_Oct_21_1313,training_fmri,3.2.4,None,
,3,"What is the lecture hall like?
","What class are the students in, and what is the day’s lecture about?
","What is something taught in lecture?
","What is the next assessment/assignment for the class, and when is it scheduled/due?","What class are the students in, and what was yesterday’s lecture about?","What is the lecture hall’s max capacity?
",Dean of Academic Studies,jobphotos/dean.jpg,,,,,,,,,,,,,,,,,,,,,,,,,,,,,0,2,2,3,1,0,1,0,,,,,,,,,,,,,,,,,,,,,,,,,,,,,,,616.702941427,None,616.702941427,None,space,1.1483603280000807,616.702941427,None,617.8866896259999,None,617.8866896259999,None,617.8866896259999,None,space,0.598549266000191,617.8866896259999,None,618.521042285,None,618.521042285,None,618.521042285,None,space,1.096167535000177,618.521042285,None,619.654301174,None,619.654301174,None,619.654301174,None,space,0.7231404220001423,619.654301174,None,620.436871445,None,620.436871445,None,620.436871445,None,space,1.769214194999904,620.436871445,None,622.237268068,None,space,0.6239990619999389,622.237268068,None,622.954273888,None,622.954273888,None,622.954273888,None,622.954273888,None,622.954273888,None,622.954273888,None,622.954273888,None,,,,,,,,,,,,,,,,,,,,,,,,,,,102121,2,3,0,3,2021_Oct_21_1313,training_fmri,3.2.4,None,
,3,,,,,,,,,,,,,,,,,,,,,,,,,,,,,,,,,,,,,0,2,2,3,,,,,,,,,,,,,,,,,,,,,,,,,,,,,,,,,,,,,,,,,,,,,,,,,,,,,,,,,,,,,,,,,,,,,,,,,,,,,,,,,,,,,,,,,,,,,,,,,,,,,,,,,,,,,,,,,,,,,,,,,,,,,,,,,102121,2,3,0,3,2021_Oct_21_1313,training_fmri,3.2.4,None,
,1,What object is the initiator of the interaction holding when he/she first notices the other person?,What is the initial question that begins the conversation between the couple?,When will be the next time the couple meets and for what occasion?,"What time is it when the couple parts?
",What is the initial question that ends the conversation between the couple?,What object is the initiator of the interaction holding when he/she leaves the other person?,Matchmaker,jobphotos/matchmaker.jpg,,,,,,,,,,,,,,,,,,,,,,,,,,,,,0,3,3,1,0,0,0,0,,,,,,,,,,,,,,,,,,,,,,,,,,,,,,,634.3869229930001,None,634.3869229930001,None,space,0.7709357900000668,634.3869229930001,None,635.2204611259999,None,635.2204611259999,None,635.2204611259999,None,space,7.314617227999861,635.2204611259999,None,642.586970631,None,642.586970631,None,642.586970631,None,space,1.5595005899999705,642.586970631,None,644.2039632599999,None,644.2039632599999,None,644.2039632599999,None,space,1.660518719000038,644.2039632599999,None,645.920944625,None,645.920944625,None,645.920944625,None,space,2.561564133000047,645.920944625,None,648.5040253689999,None,space,0.48927393799999663,648.5040253689999,None,649.1209229359999,None,649.1209229359999,None,649.1209229359999,None,649.1209229359999,None,649.1209229359999,None,649.1209229359999,None,649.1209229359999,None,,,,,,,,,,,,,,,,,,,,,,,,,,,102121,2,3,0,3,2021_Oct_21_1313,training_fmri,3.2.4,None,
,1,,,,,,,,,,,,,,,,,,,,,,,,,,,,,,,,,,,,,0,3,3,1,,,,,,,,,,,,,,,,,,,,,,,,,,,,,,,,,,,,,,,,,,,,,,,,,,,,,,,,,,,,,,,,,,,,,,,,,,,,,,,,,,,,,,,,,,,,,,,,,,,,,,,,,,,,,,,,,,,,,,,,,,,,,,,,,102121,2,3,0,3,2021_Oct_21_1313,training_fmri,3.2.4,None,
,1,What object is the initiator of the interaction holding when he/she first notices the other person?,What is the initial question that begins the conversation between the couple?,When will be the next time the couple meets and for what occasion?,"What time is it when the couple parts?
",What is the initial question that ends the conversation between the couple?,What object is the initiator of the interaction holding when he/she leaves the other person?,Matchmaker,jobphotos/matchmaker.jpg,,,,,,,,,,,,,,,,,,,,,,,,,,,,,,,,,,,,,0,0,0,1,0,0,0,0,,,,,,,,,,,,,,,,,,,,,,,,,,,,,,,,,,,,,,,,,,,,,,,,,,,,,,,,,,,,,,,,,,,,,,,,,,,,,,,,,,,,,,,,,,,666.920455102,None,667.954489427,None,space,0.6749363829999311,667.954489427,None,667.954489427,None,668.753535264,None,668.753535264,None,668.753535264,None,668.753535264,None,668.753535264,None,668.753535264,None,668.753535264,None,,,102121,2,3,0,3,2021_Oct_21_1313,training_fmri,3.2.4,None,
,1,,,,,,,,,,,,,,,,,,,,,,,,,,,,,,,,,,,,,,,,,,,,,0,0,0,1,,,,,,,,,,,,,,,,,,,,,,,,,,,,,,,,,,,,,,,,,,,,,,,,,,,,,,,,,,,,,,,,,,,,,,,,,,,,,,,,,,,,,,,,,,,,,,,,,,,,,,,,,,,,,,,,,,,,,,,,,102121,2,3,0,3,2021_Oct_21_1313,training_fmri,3.2.4,None,
,3,"What is the lecture hall like?
","What class are the students in, and what is the day’s lecture about?
","What is something taught in lecture?
","What is the next assessment/assignment for the class, and when is it scheduled/due?","What class are the students in, and what was yesterday’s lecture about?","What is the lecture hall’s max capacity?
",Dean of Academic Studies,jobphotos/dean.jpg,,,,,,,,,,,,,,,,,,,,,,,,,,,,,,,,,,,,,0,1,1,3,0,0,0,0,,,,,,,,,,,,,,,,,,,,,,,,,,,,,,,,,,,,,,,,,,,,,,,,,,,,,,,,,,,,,,,,,,,,,,,,,,,,,,,,,,,,,,,,,,,,,683.686846306,None,space,1.1112356779999573,683.686846306,None,683.686846306,None,684.9040501070001,None,684.9040501070001,None,684.9040501070001,None,684.9040501070001,None,684.9040501070001,None,684.9040501070001,None,684.9040501070001,None,,,102121,2,3,0,3,2021_Oct_21_1313,training_fmri,3.2.4,None,
,3,,,,,,,,,,,,,,,,,,,,,,,,,,,,,,,,,,,,,,,,,,,,,0,1,1,3,,,,,,,,,,,,,,,,,,,,,,,,,,,,,,,,,,,,,,,,,,,,,,,,,,,,,,,,,,,,,,,,,,,,,,,,,,,,,,,,,,,,,,,,,,,,,,,,,,,,,,,,,,,,,,,,,,,,,,,,,102121,2,3,0,3,2021_Oct_21_1313,training_fmri,3.2.4,None,
