,2,How is the restaurant decorated?,What are the menus like?,"What does each client order?
",How do the clients like the food?,How is the restaurant supplied?,How do the clients like the chairs?,Restaurant Critic,jobphotos/restaurant_critic.jpg,,,,,,,,,,,,,,,,,,,,,,,,,,,,,,,,,,,,,0,2,2,2,0,0,0,0,,,,,,,,,,,,,,,,,,,,,,,,,,,,,,,,,,,,,,,,,,,,,,,,,,,,,,,,,,,,,,,,,,,,,,,,,,,,,,,,,,,,,,,,,,,,,700.786539429,None,space,0.7735298379998312,700.786539429,None,700.786539429,None,701.6697083399999,None,701.6697083399999,None,701.6697083399999,None,701.6697083399999,None,701.6697083399999,None,701.6697083399999,None,701.6697083399999,None,,,102121,2,3,0,3,2021_Oct_21_1313,training_fmri,3.2.4,None,
,2,,,,,,,,,,,,,,,,,,,,,,,,,,,,,,,,,,,,,,,,,,,,,0,2,2,2,,,,,,,,,,,,,,,,,,,,,,,,,,,,,,,,,,,,,,,,,,,,,,,,,,,,,,,,,,,,,,,,,,,,,,,,,,,,,,,,,,,,,,,,,,,,,,,,,,,,,,,,,,,,,,,,,,,,,,,,,102121,2,3,0,3,2021_Oct_21_1313,training_fmri,3.2.4,None,
,0,What is each business person’s job title?,"How much money is at stake in the initial offer made?
",What is the name of the other industry competitor? ,With what gesture do the business partners secure the deal?,What is each business person’s salary?,How much money is at stake in the final offer made?,Business Reporter,jobphotos/business_reporter.jpg,,,,,,,,,,,,,,,,,,,,,,,,,,,,,,,,,,,,,0,3,3,0,0,0,0,0,,,,,,,,,,,,,,,,,,,,,,,,,,,,,,,,,,,,,,,,,,,,,,,,,,,,,,,,,,,,,,,,,,,,,,,,,,,,,,,,,,,,,,,,,,,,,715.920055009,None,space,0.6478538080000362,715.920055009,None,715.920055009,None,716.6699044899999,None,716.6699044899999,None,716.6699044899999,None,716.6699044899999,None,716.6699044899999,None,716.6699044899999,None,716.6699044899999,None,,,102121,2,3,0,3,2021_Oct_21_1313,training_fmri,3.2.4,None,
,0,What is each business person’s job title?,"How much money is at stake in the initial offer made?
",What is the name of the other industry competitor? ,With what gesture do the business partners secure the deal?,What is each business person’s salary?,How much money is at stake in the final offer made?,Business Reporter,jobphotos/business_reporter.jpg,,,,,,,,,,,,,,,,,,,,,,,,,,,,,,,,,,,,,0,3,3,0,1,0,1,0,,,,,,,,,,,,,,,,,,,,,,,,,,,,,,,,,,,,,,,,,,,,,,,,,,,,,,,,,,,,,,,,,,,,,,,,,,,,,,,,,,,,,,,,,,,,,732.218650715,None,space,0.5303768510000282,732.218650715,None,732.218650715,None,732.8685187789999,None,732.8685187789999,None,732.8685187789999,None,732.8685187789999,None,732.8685187789999,None,732.8685187789999,None,732.8685187789999,None,,,102121,2,3,0,3,2021_Oct_21_1313,training_fmri,3.2.4,None,
,0,,,,,,,,,,,,,,,,,,,,,,,,,,,,,,,,,,,,,,,,,,,,,0,3,3,0,,,,,,,,,,,,,,,,,,,,,,,,,,,,,,,,,,,,,,,,,,,,,,,,,,,,,,,,,,,,,,,,,,,,,,,,,,,,,,,,,,,,,,,,,,,,,,,,,,,,,,,,,,,,,,,,,,,,,,,,,102121,2,3,0,3,2021_Oct_21_1313,training_fmri,3.2.4,None,
,,,,,,,,,,,,,,,,,,,,,,,,,,,,,,,,,,,,,,,,,,,,,,,,,,,,,,,,,,,,,,,,,,,,,,,,,,,,,,,,,,,,,,,,,,,,,,,,,,,,,,,,,,,,,,,,,,,,,,,,,,,,,,,,,,,,,,,,,,,,,,,,,,,,,,,,,,,,,,,,,,,,,,,,779.968151645,None,,,,,,,,,,
